id,title,search_all,grouping,activity_type_id,description,session_type,grouping_id,activity_type,start_date
1,Pediatrics 2000,"Pediatrics 2000 Regularly Scheduled Series RSS Live All grand rounds for 2000  01/03/2000  2000  01  ",Regularly Scheduled Series,1,All grand rounds for 2000,M,2,Live,2000-01-03T05:00:00Z
2,Ethics in Research,"Ethics in Research Regularly Scheduled Series RSS Live   01/03/2000  2000  01  ",Regularly Scheduled Series,1,,M,2,Live,2000-01-03T05:00:00Z
3,Pathology 2000,"Pathology 2000 Regularly Scheduled Series RSS Live All grand rounds for 2000  01/04/2000  2000  01  ",Regularly Scheduled Series,1,All grand rounds for 2000,M,2,Live,2000-01-04T05:00:00Z
4,Perinatal Autopsy in Genetic Cases,"Perinatal Autopsy in Genetic Cases Regularly Scheduled Series RSS Live   01/04/2000  2000  01  ",Regularly Scheduled Series,1,,M,2,Live,2000-01-04T05:00:00Z
5,Hematology-Oncology 2000,"Hematology-Oncology 2000 Regularly Scheduled Series RSS Live All grand rounds for 2000  01/05/2000  2000  01  ",Regularly Scheduled Series,1,All grand rounds for 2000,M,2,Live,2000-01-05T05:00:00Z
6,Testicular Cancer,"Testicular Cancer Regularly Scheduled Series RSS Live   01/05/2000  2000  01  ",Regularly Scheduled Series,1,,M,2,Live,2000-01-05T05:00:00Z
7,Neurology 2000,"Neurology 2000 Regularly Scheduled Series RSS Live All grand rounds for 2000  01/05/2000  2000  01  ",Regularly Scheduled Series,1,All grand rounds for 2000,M,2,Live,2000-01-05T05:00:00Z
8,Neurologic Complications During Coronary Bypass Surgery,"Neurologic Complications During Coronary Bypass Surgery Regularly Scheduled Series RSS Live   01/05/2000  2000  01  ",Regularly Scheduled Series,1,,M,2,Live,2000-01-05T05:00:00Z
9,Otolaryngology 2000,"Otolaryngology 2000 Regularly Scheduled Series RSS Live All grand rounds for 2000  01/05/2000  2000  01  ",Regularly Scheduled Series,1,All grand rounds for 2000,M,2,Live,2000-01-05T05:00:00Z
10,Zygomatic Implant for Dental Maxillofacial Rehabilitation,"Zygomatic Implant for Dental Maxillofacial Rehabilitation Regularly Scheduled Series RSS Live   01/05/2000  2000  01  ",Regularly Scheduled Series,1,,M,2,Live,2000-01-05T05:00:00Z
11,Psychiatry 2000,"Psychiatry 2000 Regularly Scheduled Series RSS Live   01/05/2000  2000  01  ",Regularly Scheduled Series,1,,M,2,Live,2000-01-05T05:00:00Z
12,Psychiatry Grand Rounds,"Psychiatry Grand Rounds Regularly Scheduled Series RSS Live   01/05/2000  2000  01  ",Regularly Scheduled Series,1,,M,2,Live,2000-01-05T05:00:00Z
13,Surgery 2000,"Surgery 2000 Regularly Scheduled Series RSS Live All grand rounds for 2000  01/05/2000  2000  01  ",Regularly Scheduled Series,1,All grand rounds for 2000,M,2,Live,2000-01-05T05:00:00Z
14,Skin-Sparing Mastectomy and Breast Reconstruction/ Pediatric Achalasia,"Skin-Sparing Mastectomy and Breast Reconstruction/ Pediatric Achalasia Regularly Scheduled Series RSS Live   01/05/2000  2000  01  ",Regularly Scheduled Series,1,,M,2,Live,2000-01-05T05:00:00Z
15,Physical Medicine 2000,"Physical Medicine 2000 Regularly Scheduled Series RSS Live All grand rounds for 2000  01/07/2000  2000  01  ",Regularly Scheduled Series,1,All grand rounds for 2000,M,2,Live,2000-01-07T05:00:00Z
16,Amyotrophiic Lateral Schlerosis in a 27 year old,"Amyotrophiic Lateral Schlerosis in a 27 year old Regularly Scheduled Series RSS Live   01/07/2000  2000  01  ",Regularly Scheduled Series,1,,M,2,Live,2000-01-07T05:00:00Z
17,Orthopaedic Surgery 2000,"Orthopaedic Surgery 2000 Regularly Scheduled Series RSS Live All grand rounds for 2000  01/08/2000  2000  01  ",Regularly Scheduled Series,1,All grand rounds for 2000,M,2,Live,2000-01-08T05:00:00Z
18,Leg-Calve-Perthes Disease: An Obscure Affection of the Hip Joint in Children,"Leg-Calve-Perthes Disease: An Obscure Affection of the Hip Joint in Children Regularly Scheduled Series RSS Live   01/08/2000  2000  01  ",Regularly Scheduled Series,1,,M,2,Live,2000-01-08T05:00:00Z
19,Applications of Cytology in Today's Medical Market,"Applications of Cytology in Today's Medical Market Regularly Scheduled Series RSS Live   01/10/2000  2000  01  ",Regularly Scheduled Series,1,,M,2,Live,2000-01-10T05:00:00Z
20,Ethics in Research,"Ethics in Research Regularly Scheduled Series RSS Live   01/10/2000  2000  01  ",Regularly Scheduled Series,1,,M,2,Live,2000-01-10T05:00:00Z
21,Radiology 2000,"Radiology 2000 Regularly Scheduled Series RSS Live All grand rounds for 2000  01/10/2000  2000  01  ",Regularly Scheduled Series,1,All grand rounds for 2000,M,2,Live,2000-01-10T05:00:00Z
22,Intra-abdominal Pathways for the Spread of Disease:  Peritoneal Ligaments and Mesenteries,"Intra-abdominal Pathways for the Spread of Disease:  Peritoneal Ligaments and Mesenteries Regularly Scheduled Series RSS Live   01/10/2000  2000  01  ",Regularly Scheduled Series,1,,M,2,Live,2000-01-10T05:00:00Z
23,Spiral CT of the Abdomen:  An Old Dog with Some New Tricks,"Spiral CT of the Abdomen:  An Old Dog with Some New Tricks Regularly Scheduled Series RSS Live   01/10/2000  2000  01  ",Regularly Scheduled Series,1,,M,2,Live,2000-01-10T05:00:00Z
24,Anesthesia 2000,"Anesthesia 2000 Regularly Scheduled Series RSS Live All grand rounds for 2000  01/12/2000  2000  01  ",Regularly Scheduled Series,1,All grand rounds for 2000,M,2,Live,2000-01-12T05:00:00Z
25,Pain Management in Children with Cancer,"Pain Management in Children with Cancer Regularly Scheduled Series RSS Live   01/12/2000  2000  01  ",Regularly Scheduled Series,1,,M,2,Live,2000-01-12T05:00:00Z
26,Emergency Medicine 2000,"Emergency Medicine 2000 Regularly Scheduled Series RSS Live All grand rounds for 2000  01/12/2000  2000  01  ",Regularly Scheduled Series,1,All grand rounds for 2000,M,2,Live,2000-01-12T05:00:00Z
27,EM Ultrasound Tutorial,"EM Ultrasound Tutorial Regularly Scheduled Series RSS Live   01/12/2000  2000  01  ",Regularly Scheduled Series,1,,M,2,Live,2000-01-12T05:00:00Z
28,Periampullar Carcinoid,"Periampullar Carcinoid Regularly Scheduled Series RSS Live   01/12/2000  2000  01  ",Regularly Scheduled Series,1,,M,2,Live,2000-01-12T05:00:00Z
29,Internal Medicine 2000,"Internal Medicine 2000 Regularly Scheduled Series RSS Live All grand rounds for 2000  01/12/2000  2000  01  ",Regularly Scheduled Series,1,All grand rounds for 2000,M,2,Live,2000-01-12T05:00:00Z
30,Determinants of Daytime Sleepiness,"Determinants of Daytime Sleepiness Regularly Scheduled Series RSS Live   01/12/2000  2000  01  ",Regularly Scheduled Series,1,,M,2,Live,2000-01-12T05:00:00Z
31,"Chronic, Daily Headaches in Children","Chronic, Daily Headaches in Children Regularly Scheduled Series RSS Live   01/12/2000  2000  01  ",Regularly Scheduled Series,1,,M,2,Live,2000-01-12T05:00:00Z
32,Nasal Granulomatous Diseases,"Nasal Granulomatous Diseases Regularly Scheduled Series RSS Live   01/12/2000  2000  01  ",Regularly Scheduled Series,1,,M,2,Live,2000-01-12T05:00:00Z
33,Psychiatry Grand Rounds,"Psychiatry Grand Rounds Regularly Scheduled Series RSS Live   01/12/2000  2000  01  ",Regularly Scheduled Series,1,,M,2,Live,2000-01-12T05:00:00Z
34,Surgical Grand Rounds,"Surgical Grand Rounds Regularly Scheduled Series RSS Live   01/12/2000  2000  01  ",Regularly Scheduled Series,1,,M,2,Live,2000-01-12T05:00:00Z
35,The Role of Serum Phosphate Control in Secondary Hyperparathyroidism among Hemodialysis,"The Role of Serum Phosphate Control in Secondary Hyperparathyroidism among Hemodialysis Regularly Scheduled Series RSS Live   01/14/2000  2000  01  ",Regularly Scheduled Series,1,,M,2,Live,2000-01-14T05:00:00Z
36,Ophthalmology 2000,"Ophthalmology 2000 Regularly Scheduled Series RSS Live All grand rounds for 2000  01/15/2000  2000  01  ",Regularly Scheduled Series,1,All grand rounds for 2000,M,2,Live,2000-01-15T05:00:00Z
37,Orbital Disease and Plastic Surgery Case Conference,"Orbital Disease and Plastic Surgery Case Conference Regularly Scheduled Series RSS Live   01/15/2000  2000  01  ",Regularly Scheduled Series,1,,M,2,Live,2000-01-15T05:00:00Z
38,Injuries to the Acromioclavicular Joint,"Injuries to the Acromioclavicular Joint Regularly Scheduled Series RSS Live   01/15/2000  2000  01  ",Regularly Scheduled Series,1,,M,2,Live,2000-01-15T05:00:00Z
39,Membranous Glomerulonephritis,"Membranous Glomerulonephritis Regularly Scheduled Series RSS Live   01/18/2000  2000  01  ",Regularly Scheduled Series,1,,M,2,Live,2000-01-18T05:00:00Z
40,Perioperative Services - Facility Planning and Design Issues,"Perioperative Services - Facility Planning and Design Issues Regularly Scheduled Series RSS Live   01/19/2000  2000  01  ",Regularly Scheduled Series,1,,M,2,Live,2000-01-19T05:00:00Z
41,What's new in neuromuscular blocking agents,"What's new in neuromuscular blocking agents Regularly Scheduled Series RSS Live   01/19/2000  2000  01  ",Regularly Scheduled Series,1,,M,2,Live,2000-01-19T05:00:00Z
42,EM Ultrasound Tutorial,"EM Ultrasound Tutorial Regularly Scheduled Series RSS Live   01/19/2000  2000  01  ",Regularly Scheduled Series,1,,M,2,Live,2000-01-19T05:00:00Z
43,General Internal Medicine 2000,"General Internal Medicine 2000 Regularly Scheduled Series RSS Live All grand rounds for 2000  01/19/2000  2000  01  ",Regularly Scheduled Series,1,All grand rounds for 2000,M,2,Live,2000-01-19T05:00:00Z
44,Transient Visual Phenomena,"Transient Visual Phenomena Regularly Scheduled Series RSS Live   01/19/2000  2000  01  ",Regularly Scheduled Series,1,,M,2,Live,2000-01-19T05:00:00Z
45,Small BowelTumor,"Small BowelTumor Regularly Scheduled Series RSS Live   01/19/2000  2000  01  ",Regularly Scheduled Series,1,,M,2,Live,2000-01-19T05:00:00Z
46,Left Ventricular Assist in End-Stage Heart Failure,"Left Ventricular Assist in End-Stage Heart Failure Regularly Scheduled Series RSS Live   01/19/2000  2000  01  ",Regularly Scheduled Series,1,,M,2,Live,2000-01-19T05:00:00Z
47,Measuring Cortical Excitability in Neuro-behavioral Disorders,"Measuring Cortical Excitability in Neuro-behavioral Disorders Regularly Scheduled Series RSS Live   01/19/2000  2000  01  ",Regularly Scheduled Series,1,,M,2,Live,2000-01-19T05:00:00Z
48,Lacrimal Sac Problems,"Lacrimal Sac Problems Regularly Scheduled Series RSS Live   01/19/2000  2000  01  ",Regularly Scheduled Series,1,,M,2,Live,2000-01-19T05:00:00Z
49,Endoscopic Resection of Pituitary Tumors,"Endoscopic Resection of Pituitary Tumors Regularly Scheduled Series RSS Live   01/19/2000  2000  01  ",Regularly Scheduled Series,1,,M,2,Live,2000-01-19T05:00:00Z
50,The Ethics of Psychiatric Symptom,"The Ethics of Psychiatric Symptom Regularly Scheduled Series RSS Live   01/19/2000  2000  01  ",Regularly Scheduled Series,1,,M,2,Live,2000-01-19T05:00:00Z
51,Surgical Grand Rounds,"Surgical Grand Rounds Regularly Scheduled Series RSS Live   01/19/2000  2000  01  ",Regularly Scheduled Series,1,,M,2,Live,2000-01-19T05:00:00Z
52,Detecting Hazardous Drinking in Primary Care Settings,"Detecting Hazardous Drinking in Primary Care Settings Regularly Scheduled Series RSS Live   01/21/2000  2000  01  ",Regularly Scheduled Series,1,,M,2,Live,2000-01-21T05:00:00Z
53,Hematology/Oncology Grand Rounds,"Hematology/Oncology Grand Rounds Regularly Scheduled Series RSS Live   01/21/2000  2000  01  ",Regularly Scheduled Series,1,,M,2,Live,2000-01-21T05:00:00Z
54,Ethics in Research,"Ethics in Research Regularly Scheduled Series RSS Live   01/21/2000  2000  01  ",Regularly Scheduled Series,1,,M,2,Live,2000-01-21T05:00:00Z
55,ACL Reconstruction in the Adolescent,"ACL Reconstruction in the Adolescent Regularly Scheduled Series RSS Live   01/22/2000  2000  01  ",Regularly Scheduled Series,1,,M,2,Live,2000-01-22T05:00:00Z
56,Abusive Infant Head Trauma,"Abusive Infant Head Trauma Regularly Scheduled Series RSS Live   01/24/2000  2000  01  ",Regularly Scheduled Series,1,,M,2,Live,2000-01-24T05:00:00Z
57,Ethics in Research,"Ethics in Research Regularly Scheduled Series RSS Live   01/24/2000  2000  01  ",Regularly Scheduled Series,1,,M,2,Live,2000-01-24T05:00:00Z
58,Anesthesia for Patients with Epidermolysis,"Anesthesia for Patients with Epidermolysis Regularly Scheduled Series RSS Live   01/26/2000  2000  01  ",Regularly Scheduled Series,1,,M,2,Live,2000-01-26T05:00:00Z
59,Lung Ca./Non-Hodgkin's Lymphoma,"Lung Ca./Non-Hodgkin's Lymphoma Regularly Scheduled Series RSS Live   01/26/2000  2000  01  ",Regularly Scheduled Series,1,,M,2,Live,2000-01-26T05:00:00Z
60,The Tao of Antibiotics,"The Tao of Antibiotics Regularly Scheduled Series RSS Live   01/26/2000  2000  01  ",Regularly Scheduled Series,1,,M,2,Live,2000-01-26T05:00:00Z
61,Deciding When to Start and Stop Antiepileptic Drugs:  Weighing the Evidence,"Deciding When to Start and Stop Antiepileptic Drugs:  Weighing the Evidence Regularly Scheduled Series RSS Live   01/26/2000  2000  01  ",Regularly Scheduled Series,1,,M,2,Live,2000-01-26T05:00:00Z
62,Anterior Ischemic Optic Neuropathy,"Anterior Ischemic Optic Neuropathy Regularly Scheduled Series RSS Live   01/26/2000  2000  01  ",Regularly Scheduled Series,1,,M,2,Live,2000-01-26T05:00:00Z
63,Gender Identity Disorders in Adulthood,"Gender Identity Disorders in Adulthood Regularly Scheduled Series RSS Live   01/26/2000  2000  01  ",Regularly Scheduled Series,1,,M,2,Live,2000-01-26T05:00:00Z
64,Surgical Grand Rounds,"Surgical Grand Rounds Regularly Scheduled Series RSS Live   01/26/2000  2000  01  ",Regularly Scheduled Series,1,,M,2,Live,2000-01-26T05:00:00Z
65,Hyperbaric Oxygen for Traumatic Brain Injury,"Hyperbaric Oxygen for Traumatic Brain Injury Regularly Scheduled Series RSS Live   01/28/2000  2000  01  ",Regularly Scheduled Series,1,,M,2,Live,2000-01-28T05:00:00Z
66,Total Elbow Replacements,"Total Elbow Replacements Regularly Scheduled Series RSS Live   01/29/2000  2000  01  ",Regularly Scheduled Series,1,,M,2,Live,2000-01-29T05:00:00Z
67,Ethics in Research,"Ethics in Research Regularly Scheduled Series RSS Live   01/31/2000  2000  01  ",Regularly Scheduled Series,1,,M,2,Live,2000-01-31T05:00:00Z
68,Vaporizers - Ancient to Modern or How We Got Here From There,"Vaporizers - Ancient to Modern or How We Got Here From There Regularly Scheduled Series RSS Live   02/02/2000  2000  02  ",Regularly Scheduled Series,1,,M,2,Live,2000-02-02T05:00:00Z
69,Prevention of Colorectal Cancer,"Prevention of Colorectal Cancer Regularly Scheduled Series RSS Live   02/02/2000  2000  02  ",Regularly Scheduled Series,1,,M,2,Live,2000-02-02T05:00:00Z
70,Guillain Barre Syndrome,"Guillain Barre Syndrome Regularly Scheduled Series RSS Live   02/02/2000  2000  02  ",Regularly Scheduled Series,1,,M,2,Live,2000-02-02T05:00:00Z
71,Cataract Surgery Case Conference,"Cataract Surgery Case Conference Regularly Scheduled Series RSS Live   02/02/2000  2000  02  ",Regularly Scheduled Series,1,,M,2,Live,2000-02-02T05:00:00Z
72,Clinical Uses of Botox,"Clinical Uses of Botox Regularly Scheduled Series RSS Live   02/02/2000  2000  02  ",Regularly Scheduled Series,1,,M,2,Live,2000-02-02T05:00:00Z
73,The Varieties of the Schizophrenia's,"The Varieties of the Schizophrenia's Regularly Scheduled Series RSS Live   02/02/2000  2000  02  ",Regularly Scheduled Series,1,,M,2,Live,2000-02-02T05:00:00Z
74,Surgical Grand Rounds,"Surgical Grand Rounds Regularly Scheduled Series RSS Live   02/02/2000  2000  02  ",Regularly Scheduled Series,1,,M,2,Live,2000-02-02T05:00:00Z
75,Hematology/Oncology Grand Rounds,"Hematology/Oncology Grand Rounds Regularly Scheduled Series RSS Live   02/04/2000  2000  02  ",Regularly Scheduled Series,1,,M,2,Live,2000-02-04T05:00:00Z
76,Hepatitis C,"Hepatitis C Regularly Scheduled Series RSS Live   02/07/2000  2000  02  ",Regularly Scheduled Series,1,,M,2,Live,2000-02-07T05:00:00Z
77,Perinatal Autopsy,"Perinatal Autopsy Regularly Scheduled Series RSS Live   02/07/2000  2000  02  ",Regularly Scheduled Series,1,,M,2,Live,2000-02-07T05:00:00Z
78,Ethics in Research,"Ethics in Research Regularly Scheduled Series RSS Live   02/07/2000  2000  02  ",Regularly Scheduled Series,1,,M,2,Live,2000-02-07T05:00:00Z
79,Prevention of Osteopororotic fractures in primary care: Patient outcomes and quality of care,"Prevention of Osteopororotic fractures in primary care: Patient outcomes and quality of care Regularly Scheduled Series RSS Live   02/09/2000  2000  02  ",Regularly Scheduled Series,1,,M,2,Live,2000-02-09T05:00:00Z
80,Postanoxic Myoclonus,"Postanoxic Myoclonus Regularly Scheduled Series RSS Live   02/09/2000  2000  02  ",Regularly Scheduled Series,1,,M,2,Live,2000-02-09T05:00:00Z
81,Cataracts and Glaucoma A New Perspective,"Cataracts and Glaucoma A New Perspective Regularly Scheduled Series RSS Live   02/09/2000  2000  02  ",Regularly Scheduled Series,1,,M,2,Live,2000-02-09T05:00:00Z
82,Updates on the Use of Antimetabolites in Filtration Surgery,"Updates on the Use of Antimetabolites in Filtration Surgery Regularly Scheduled Series RSS Live   02/09/2000  2000  02  ",Regularly Scheduled Series,1,,M,2,Live,2000-02-09T05:00:00Z
83,Importance of Voice Analysis and Measurement to Patient Management,"Importance of Voice Analysis and Measurement to Patient Management Regularly Scheduled Series RSS Live   02/09/2000  2000  02  ",Regularly Scheduled Series,1,,M,2,Live,2000-02-09T05:00:00Z
84,This and That About Psychotherapy,"This and That About Psychotherapy Regularly Scheduled Series RSS Live   02/09/2000  2000  02  ",Regularly Scheduled Series,1,,M,2,Live,2000-02-09T05:00:00Z
85,Medication Errors and Adverse Drug Events,"Medication Errors and Adverse Drug Events Regularly Scheduled Series RSS Live   02/11/2000  2000  02  ",Regularly Scheduled Series,1,,M,2,Live,2000-02-11T05:00:00Z
86,Hematology/Oncology Grand Rounds,"Hematology/Oncology Grand Rounds Regularly Scheduled Series RSS Live   02/11/2000  2000  02  ",Regularly Scheduled Series,1,,M,2,Live,2000-02-11T05:00:00Z
87,Starting and Stopping Antiepileptic Drugs:  An Evidence-based Analysis,"Starting and Stopping Antiepileptic Drugs:  An Evidence-based Analysis Regularly Scheduled Series RSS Live   02/11/2000  2000  02  ",Regularly Scheduled Series,1,,M,2,Live,2000-02-11T05:00:00Z
88,Flexible Flatfoot,"Flexible Flatfoot Regularly Scheduled Series RSS Live   02/12/2000  2000  02  ",Regularly Scheduled Series,1,,M,2,Live,2000-02-12T05:00:00Z
89,Radiation-Induced Thyroid Carcinoma,"Radiation-Induced Thyroid Carcinoma Regularly Scheduled Series RSS Live   02/14/2000  2000  02  ",Regularly Scheduled Series,1,,M,2,Live,2000-02-14T05:00:00Z
90,Ethics in Research,"Ethics in Research Regularly Scheduled Series RSS Live   02/14/2000  2000  02  ",Regularly Scheduled Series,1,,M,2,Live,2000-02-14T05:00:00Z
91,Prolonged Q-T Syndrome,"Prolonged Q-T Syndrome Regularly Scheduled Series RSS Live   02/16/2000  2000  02  ",Regularly Scheduled Series,1,,M,2,Live,2000-02-16T05:00:00Z
92,Why Does Managed Care Do What it Does,"Why Does Managed Care Do What it Does Regularly Scheduled Series RSS Live   02/16/2000  2000  02  ",Regularly Scheduled Series,1,,M,2,Live,2000-02-16T05:00:00Z
93,Colon Cancer,"Colon Cancer Regularly Scheduled Series RSS Live   02/16/2000  2000  02  ",Regularly Scheduled Series,1,,M,2,Live,2000-02-16T05:00:00Z
94,New Perspectives on the Pathogenesis and Treatment of Multiple Sclerosis,"New Perspectives on the Pathogenesis and Treatment of Multiple Sclerosis Regularly Scheduled Series RSS Live   02/16/2000  2000  02  ",Regularly Scheduled Series,1,,M,2,Live,2000-02-16T05:00:00Z
95,Neuro-Ophthalmology Conference,"Neuro-Ophthalmology Conference Regularly Scheduled Series RSS Live   02/16/2000  2000  02  ",Regularly Scheduled Series,1,,M,2,Live,2000-02-16T05:00:00Z
96,Anatomic Approaches to Rhytidectomy,"Anatomic Approaches to Rhytidectomy Regularly Scheduled Series RSS Live   02/16/2000  2000  02  ",Regularly Scheduled Series,1,,M,2,Live,2000-02-16T05:00:00Z
97,Cigarettes and Alcohol:  Insights into a Common Co-Addiction,"Cigarettes and Alcohol:  Insights into a Common Co-Addiction Regularly Scheduled Series RSS Live   02/16/2000  2000  02  ",Regularly Scheduled Series,1,,M,2,Live,2000-02-16T05:00:00Z
98,Surgical Grand Rounds,"Surgical Grand Rounds Regularly Scheduled Series RSS Live   02/16/2000  2000  02  ",Regularly Scheduled Series,1,,M,2,Live,2000-02-16T05:00:00Z
99,Drug Hypersensitivity in the 21st Century,"Drug Hypersensitivity in the 21st Century Regularly Scheduled Series RSS Live   02/17/2000  2000  02  ",Regularly Scheduled Series,1,,M,2,Live,2000-02-17T05:00:00Z
100,OB/GYN 2000,"OB/GYN 2000 Regularly Scheduled Series RSS Live All grand rounds for 2000  02/17/2000  2000  02  ",Regularly Scheduled Series,1,All grand rounds for 2000,M,2,Live,2000-02-17T05:00:00Z
101,OB/GYN Grand Rounds,"OB/GYN Grand Rounds Regularly Scheduled Series RSS Live   02/17/2000  2000  02  ",Regularly Scheduled Series,1,,M,2,Live,2000-02-17T05:00:00Z
102,Role of Flow Cytometry in Immunophenotyping of Hematologic Malignancies,"Role of Flow Cytometry in Immunophenotyping of Hematologic Malignancies Regularly Scheduled Series RSS Live   02/17/2000  2000  02  ",Regularly Scheduled Series,1,,M,2,Live,2000-02-17T05:00:00Z
103,Hematology/Oncology Grand Rounds,"Hematology/Oncology Grand Rounds Regularly Scheduled Series RSS Live   02/18/2000  2000  02  ",Regularly Scheduled Series,1,,M,2,Live,2000-02-18T05:00:00Z
104,Effects of Site of Delivery on Outcome of VLBW Infants,"Effects of Site of Delivery on Outcome of VLBW Infants Regularly Scheduled Series RSS Live   02/18/2000  2000  02  ",Regularly Scheduled Series,1,,M,2,Live,2000-02-18T05:00:00Z
105,Popliteal Artery Aneurysm in Stroke Patients,"Popliteal Artery Aneurysm in Stroke Patients Regularly Scheduled Series RSS Live   02/18/2000  2000  02  ",Regularly Scheduled Series,1,,M,2,Live,2000-02-18T05:00:00Z
106,Filling in the Void in Distal Radius Fractures,"Filling in the Void in Distal Radius Fractures Regularly Scheduled Series RSS Live   02/19/2000  2000  02  ",Regularly Scheduled Series,1,,M,2,Live,2000-02-19T05:00:00Z
107,Ethics in Research,"Ethics in Research Regularly Scheduled Series RSS Live   02/21/2000  2000  02  ",Regularly Scheduled Series,1,,M,2,Live,2000-02-21T05:00:00Z
108,Case Presentation:  35-Year Old Patient with Chronic Pain,"Case Presentation:  35-Year Old Patient with Chronic Pain Regularly Scheduled Series RSS Live   02/23/2000  2000  02  ",Regularly Scheduled Series,1,,M,2,Live,2000-02-23T05:00:00Z
109,Attention Deficit Disorder in Adolescence and Adults,"Attention Deficit Disorder in Adolescence and Adults Regularly Scheduled Series RSS Live   02/23/2000  2000  02  ",Regularly Scheduled Series,1,,M,2,Live,2000-02-23T05:00:00Z
110,"Pediatric Retinal Disease, Stargardt's Disease, Best Vitelliform Macular Dystrophy, Retinal Hemorrha","Pediatric Retinal Disease, Stargardt's Disease, Best Vitelliform Macular Dystrophy, Retinal Hemorrha Regularly Scheduled Series RSS Live   02/23/2000  2000  02  ",Regularly Scheduled Series,1,,M,2,Live,2000-02-23T05:00:00Z
111,Nonhuman Primate Models of Aggression,"Nonhuman Primate Models of Aggression Regularly Scheduled Series RSS Live   02/23/2000  2000  02  ",Regularly Scheduled Series,1,,M,2,Live,2000-02-23T05:00:00Z
112,Surgical Grand Rounds,"Surgical Grand Rounds Regularly Scheduled Series RSS Live   02/23/2000  2000  02  ",Regularly Scheduled Series,1,,M,2,Live,2000-02-23T05:00:00Z
113,Hematology/Oncology Grand Rounds,"Hematology/Oncology Grand Rounds Regularly Scheduled Series RSS Live   02/25/2000  2000  02  ",Regularly Scheduled Series,1,,M,2,Live,2000-02-25T05:00:00Z
114,Impact of Physician-Patient Interaction on Helath,"Impact of Physician-Patient Interaction on Helath Regularly Scheduled Series RSS Live   02/25/2000  2000  02  ",Regularly Scheduled Series,1,,M,2,Live,2000-02-25T05:00:00Z
115,Procrit:  Patient Outcomes in Orthopaedic Surgery,"Procrit:  Patient Outcomes in Orthopaedic Surgery Regularly Scheduled Series RSS Live   02/26/2000  2000  02  ",Regularly Scheduled Series,1,,M,2,Live,2000-02-26T05:00:00Z
116,Endometrial Pathology,"Endometrial Pathology Regularly Scheduled Series RSS Live   02/28/2000  2000  02  ",Regularly Scheduled Series,1,,M,2,Live,2000-02-28T05:00:00Z
117,Ethics in Research,"Ethics in Research Regularly Scheduled Series RSS Live   02/28/2000  2000  02  ",Regularly Scheduled Series,1,,M,2,Live,2000-02-28T05:00:00Z
118,Applications of Stent Grafts in the Treatment of Vascular Diseases,"Applications of Stent Grafts in the Treatment of Vascular Diseases Regularly Scheduled Series RSS Live   02/28/2000  2000  02  ",Regularly Scheduled Series,1,,M,2,Live,2000-02-28T05:00:00Z
119,Electroanalgesia,"Electroanalgesia Regularly Scheduled Series RSS Live   03/01/2000  2000  03  ",Regularly Scheduled Series,1,,M,2,Live,2000-03-01T05:00:00Z
120,Neuroendocrine Tumor/Breast Cancer/Recur. Squamous cell ca. skin,"Neuroendocrine Tumor/Breast Cancer/Recur. Squamous cell ca. skin Regularly Scheduled Series RSS Live   03/01/2000  2000  03  ",Regularly Scheduled Series,1,,M,2,Live,2000-03-01T05:00:00Z
121,Chronic Pancreatitis:  Controversies in Treating Pain and Malabsorbtion,"Chronic Pancreatitis:  Controversies in Treating Pain and Malabsorbtion Regularly Scheduled Series RSS Live   03/01/2000  2000  03  ",Regularly Scheduled Series,1,,M,2,Live,2000-03-01T05:00:00Z
122,Retinitis Pigmentosa,"Retinitis Pigmentosa Regularly Scheduled Series RSS Live   03/01/2000  2000  03  ",Regularly Scheduled Series,1,,M,2,Live,2000-03-01T05:00:00Z
123,Obstructive Sleep Apnea in Children,"Obstructive Sleep Apnea in Children Regularly Scheduled Series RSS Live   03/01/2000  2000  03  ",Regularly Scheduled Series,1,,M,2,Live,2000-03-01T05:00:00Z
124,Pharmacotherapy of Cue-Induced Cocaine Craving,"Pharmacotherapy of Cue-Induced Cocaine Craving Regularly Scheduled Series RSS Live   03/01/2000  2000  03  ",Regularly Scheduled Series,1,,M,2,Live,2000-03-01T05:00:00Z
125,Surgical Grand Rounds,"Surgical Grand Rounds Regularly Scheduled Series RSS Live   03/01/2000  2000  03  ",Regularly Scheduled Series,1,,M,2,Live,2000-03-01T05:00:00Z
126,The Connecticut Thrombolysis for Acute Stroke Study,"The Connecticut Thrombolysis for Acute Stroke Study Regularly Scheduled Series RSS Live   03/02/2000  2000  03  ",Regularly Scheduled Series,1,,M,2,Live,2000-03-02T05:00:00Z
127,Hematology/Oncology Grand Rounds,"Hematology/Oncology Grand Rounds Regularly Scheduled Series RSS Live   03/03/2000  2000  03  ",Regularly Scheduled Series,1,,M,2,Live,2000-03-03T05:00:00Z
128,Disability:  What Happens When you Can't?,"Disability:  What Happens When you Can't? Regularly Scheduled Series RSS Live   03/03/2000  2000  03  ",Regularly Scheduled Series,1,,M,2,Live,2000-03-03T05:00:00Z
129,DDH in the Adult,"DDH in the Adult Regularly Scheduled Series RSS Live   03/04/2000  2000  03  ",Regularly Scheduled Series,1,,M,2,Live,2000-03-04T05:00:00Z
130,HIV Testing,"HIV Testing Regularly Scheduled Series RSS Live   03/06/2000  2000  03  ",Regularly Scheduled Series,1,,M,2,Live,2000-03-06T05:00:00Z
131,Ethics in Research,"Ethics in Research Regularly Scheduled Series RSS Live   03/06/2000  2000  03  ",Regularly Scheduled Series,1,,M,2,Live,2000-03-06T05:00:00Z
132,Esophageal/Rectal/Colon Cancer,"Esophageal/Rectal/Colon Cancer Regularly Scheduled Series RSS Live   03/08/2000  2000  03  ",Regularly Scheduled Series,1,,M,2,Live,2000-03-08T05:00:00Z
133,The Role of Selective Estrogen Receptor Modulators in Breast Cancer Prevention,"The Role of Selective Estrogen Receptor Modulators in Breast Cancer Prevention Regularly Scheduled Series RSS Live   03/08/2000  2000  03  ",Regularly Scheduled Series,1,,M,2,Live,2000-03-08T05:00:00Z
134,To Teach Them This Art...Hypocrates: or a tale of 4 apples and a worm,"To Teach Them This Art...Hypocrates: or a tale of 4 apples and a worm Regularly Scheduled Series RSS Live   03/08/2000  2000  03  ",Regularly Scheduled Series,1,,M,2,Live,2000-03-08T05:00:00Z
135,Frontal Sinus and Anterior Skull Base Fracture,"Frontal Sinus and Anterior Skull Base Fracture Regularly Scheduled Series RSS Live   03/08/2000  2000  03  ",Regularly Scheduled Series,1,,M,2,Live,2000-03-08T05:00:00Z
136,Ethical and Therapeutic Implications of the Study of Ketamine Effects on Humans,"Ethical and Therapeutic Implications of the Study of Ketamine Effects on Humans Regularly Scheduled Series RSS Live   03/08/2000  2000  03  ",Regularly Scheduled Series,1,,M,2,Live,2000-03-08T05:00:00Z
137,Surgical Grand Rounds,"Surgical Grand Rounds Regularly Scheduled Series RSS Live   03/08/2000  2000  03  ",Regularly Scheduled Series,1,,M,2,Live,2000-03-08T05:00:00Z
138,The Cost-Effectivness of Different Management Strategies for Chronic Warfarin Patients,"The Cost-Effectivness of Different Management Strategies for Chronic Warfarin Patients Regularly Scheduled Series RSS Live   03/10/2000  2000  03  ",Regularly Scheduled Series,1,,M,2,Live,2000-03-10T05:00:00Z
139,Hematology/Oncology Grand Rounds,"Hematology/Oncology Grand Rounds Regularly Scheduled Series RSS Live   03/10/2000  2000  03  ",Regularly Scheduled Series,1,,M,2,Live,2000-03-10T05:00:00Z
140,Advances in the Care of Amputees,"Advances in the Care of Amputees Regularly Scheduled Series RSS Live   03/10/2000  2000  03  ",Regularly Scheduled Series,1,,M,2,Live,2000-03-10T05:00:00Z
141,Elbow Injuries in the Throwing Athlete,"Elbow Injuries in the Throwing Athlete Regularly Scheduled Series RSS Live   03/11/2000  2000  03  ",Regularly Scheduled Series,1,,M,2,Live,2000-03-11T05:00:00Z
142,Pathology of Liver Transplantation,"Pathology of Liver Transplantation Regularly Scheduled Series RSS Live   03/13/2000  2000  03  ",Regularly Scheduled Series,1,,M,2,Live,2000-03-13T05:00:00Z
143,"The Process, Pitfalls, and Positive Aspects of Organ Donation","The Process, Pitfalls, and Positive Aspects of Organ Donation Regularly Scheduled Series RSS Live   03/15/2000  2000  03  ",Regularly Scheduled Series,1,,M,2,Live,2000-03-15T05:00:00Z
144,Thyroid Vignettes: Controversies in the Mgmt of Autoimmune Thyroid Disease,"Thyroid Vignettes: Controversies in the Mgmt of Autoimmune Thyroid Disease Regularly Scheduled Series RSS Live   03/15/2000  2000  03  ",Regularly Scheduled Series,1,,M,2,Live,2000-03-15T05:00:00Z
145,"Central Serous Retinopathy:  Disease Variants and the New Etiologic Theory, Open-Globe Injuries:","Central Serous Retinopathy:  Disease Variants and the New Etiologic Theory, Open-Globe Injuries: Regularly Scheduled Series RSS Live   03/15/2000  2000  03  ",Regularly Scheduled Series,1,,M,2,Live,2000-03-15T05:00:00Z
146,Laryngotracheal Stenosis in the Adult,"Laryngotracheal Stenosis in the Adult Regularly Scheduled Series RSS Live   03/15/2000  2000  03  ",Regularly Scheduled Series,1,,M,2,Live,2000-03-15T05:00:00Z
147,Cocaine Self Administration Explained,"Cocaine Self Administration Explained Regularly Scheduled Series RSS Live   03/15/2000  2000  03  ",Regularly Scheduled Series,1,,M,2,Live,2000-03-15T05:00:00Z
148,Surgical Grand Rounds,"Surgical Grand Rounds Regularly Scheduled Series RSS Live   03/15/2000  2000  03  ",Regularly Scheduled Series,1,,M,2,Live,2000-03-15T05:00:00Z
149,The Pathogenesis of IgA Nephropathy,"The Pathogenesis of IgA Nephropathy Regularly Scheduled Series RSS Live   03/15/2000  2000  03  ",Regularly Scheduled Series,1,,M,2,Live,2000-03-15T05:00:00Z
150,OB/GYN Grand Rounds,"OB/GYN Grand Rounds Regularly Scheduled Series RSS Live   03/16/2000  2000  03  ",Regularly Scheduled Series,1,,M,2,Live,2000-03-16T05:00:00Z
151,Hematology/Oncology Grand Rounds,"Hematology/Oncology Grand Rounds Regularly Scheduled Series RSS Live   03/17/2000  2000  03  ",Regularly Scheduled Series,1,,M,2,Live,2000-03-17T05:00:00Z
152,Health Status Assessment of the Greater Cincinnati Area,"Health Status Assessment of the Greater Cincinnati Area Regularly Scheduled Series RSS Live   03/17/2000  2000  03  ",Regularly Scheduled Series,1,,M,2,Live,2000-03-17T05:00:00Z
153,Osteogenesis Imperfecta and it's Rehabilitation,"Osteogenesis Imperfecta and it's Rehabilitation Regularly Scheduled Series RSS Live   03/17/2000  2000  03  ",Regularly Scheduled Series,1,,M,2,Live,2000-03-17T05:00:00Z
154,Surgical & Anesthesia Consideration for Abdominal Aortic Aneurysm Repair Via and Enovascular Graft,"Surgical & Anesthesia Consideration for Abdominal Aortic Aneurysm Repair Via and Enovascular Graft Regularly Scheduled Series RSS Live   03/22/2000  2000  03  ",Regularly Scheduled Series,1,,M,2,Live,2000-03-22T05:00:00Z
155,Recurring Rectal Cancer,"Recurring Rectal Cancer Regularly Scheduled Series RSS Live   03/22/2000  2000  03  ",Regularly Scheduled Series,1,,M,2,Live,2000-03-22T05:00:00Z
156,Why the Guidelines for Treatment of COPD are Changing so Quickly,"Why the Guidelines for Treatment of COPD are Changing so Quickly Regularly Scheduled Series RSS Live   03/22/2000  2000  03  ",Regularly Scheduled Series,1,,M,2,Live,2000-03-22T05:00:00Z
157,Surgical Grand Rounds,"Surgical Grand Rounds Regularly Scheduled Series RSS Live   03/22/2000  2000  03  ",Regularly Scheduled Series,1,,M,2,Live,2000-03-22T05:00:00Z
158,Double Trouble: The Dual Diagnosis of SCI and TBI,"Double Trouble: The Dual Diagnosis of SCI and TBI Regularly Scheduled Series RSS Live   03/24/2000  2000  03  ",Regularly Scheduled Series,1,,M,2,Live,2000-03-24T05:00:00Z
159,Tubulointerstitial Renal Diseases,"Tubulointerstitial Renal Diseases Regularly Scheduled Series RSS Live   03/27/2000  2000  03  ",Regularly Scheduled Series,1,,M,2,Live,2000-03-27T05:00:00Z
160,Preemtive Analgesia,"Preemtive Analgesia Regularly Scheduled Series RSS Live   03/29/2000  2000  03  ",Regularly Scheduled Series,1,,M,2,Live,2000-03-29T05:00:00Z
161,Heritable Thrombophilia and hypofibronolysis.  Possible Causes of Retinal Vein Occlusion,"Heritable Thrombophilia and hypofibronolysis.  Possible Causes of Retinal Vein Occlusion Regularly Scheduled Series RSS Live   03/29/2000  2000  03  ",Regularly Scheduled Series,1,,M,2,Live,2000-03-29T05:00:00Z
162,Current Management of Esophageal Cancer,"Current Management of Esophageal Cancer Regularly Scheduled Series RSS Live   03/29/2000  2000  03  ",Regularly Scheduled Series,1,,M,2,Live,2000-03-29T05:00:00Z
163,"Current and New Pharmacological Approaches to Treatment of Heroin, Cocaine & Alcohol Dependence","Current and New Pharmacological Approaches to Treatment of Heroin, Cocaine & Alcohol Dependence Regularly Scheduled Series RSS Live   03/29/2000  2000  03  ",Regularly Scheduled Series,1,,M,2,Live,2000-03-29T05:00:00Z
164,Non-Pharmacologic Therapy for Atrial Fibrillation,"Non-Pharmacologic Therapy for Atrial Fibrillation Regularly Scheduled Series RSS Live   03/29/2000  2000  03  ",Regularly Scheduled Series,1,,M,2,Live,2000-03-29T05:00:00Z
165,Surgical Grand Rounds,"Surgical Grand Rounds Regularly Scheduled Series RSS Live   03/29/2000  2000  03  ",Regularly Scheduled Series,1,,M,2,Live,2000-03-29T05:00:00Z
166,Advances in the Treatment of Depression in Women,"Advances in the Treatment of Depression in Women Regularly Scheduled Series RSS Live   03/30/2000  2000  03  ",Regularly Scheduled Series,1,,M,2,Live,2000-03-30T05:00:00Z
167,Hematology/Oncology Grand Rounds,"Hematology/Oncology Grand Rounds Regularly Scheduled Series RSS Live   03/31/2000  2000  03  ",Regularly Scheduled Series,1,,M,2,Live,2000-03-31T05:00:00Z
168,Current Concepts in Shoulder Arthroplasty,"Current Concepts in Shoulder Arthroplasty Regularly Scheduled Series RSS Live   04/01/2000  2000  04  ",Regularly Scheduled Series,1,,M,2,Live,2000-04-01T05:00:00Z
169,Non-Neoplastic Lesions and Disorders Simulating Metastatic Carcinoma to the Choroid,"Non-Neoplastic Lesions and Disorders Simulating Metastatic Carcinoma to the Choroid Regularly Scheduled Series RSS Live   04/05/2000  2000  04  ",Regularly Scheduled Series,1,,M,2,Live,2000-04-05T04:00:00Z
170,Benefit of Feeding Assessment Prior to Pediatric Airway Reconstruction,"Benefit of Feeding Assessment Prior to Pediatric Airway Reconstruction Regularly Scheduled Series RSS Live   04/05/2000  2000  04  ",Regularly Scheduled Series,1,,M,2,Live,2000-04-05T04:00:00Z
171,Longitudinal Course and Treatment of Anxiety Disorders,"Longitudinal Course and Treatment of Anxiety Disorders Regularly Scheduled Series RSS Live   04/05/2000  2000  04  ",Regularly Scheduled Series,1,,M,2,Live,2000-04-05T04:00:00Z
172,Surgical Grand Rounds,"Surgical Grand Rounds Regularly Scheduled Series RSS Live   04/05/2000  2000  04  ",Regularly Scheduled Series,1,,M,2,Live,2000-04-05T04:00:00Z
173,Where Have All the O.I.'s Gone?  Opportunistic Disease in the Era of Highly Active Anti-retroviral T,"Where Have All the O.I.'s Gone?  Opportunistic Disease in the Era of Highly Active Anti-retroviral T Regularly Scheduled Series RSS Live   04/05/2000  2000  04  ",Regularly Scheduled Series,1,,M,2,Live,2000-04-05T04:00:00Z
174,Hematology/Oncology Grand Rounds,"Hematology/Oncology Grand Rounds Regularly Scheduled Series RSS Live   04/07/2000  2000  04  ",Regularly Scheduled Series,1,,M,2,Live,2000-04-07T04:00:00Z
175,Decision Making in Hepatitis C - Do Doctors and Patients Think the Same,"Decision Making in Hepatitis C - Do Doctors and Patients Think the Same Regularly Scheduled Series RSS Live   04/07/2000  2000  04  ",Regularly Scheduled Series,1,,M,2,Live,2000-04-07T04:00:00Z
176,Vestibular Rehabilitation,"Vestibular Rehabilitation Regularly Scheduled Series RSS Live   04/07/2000  2000  04  ",Regularly Scheduled Series,1,,M,2,Live,2000-04-07T04:00:00Z
177,Palliative Care and Internal Medicine - A Good Fit,"Palliative Care and Internal Medicine - A Good Fit Regularly Scheduled Series RSS Live   04/10/2000  2000  04  ",Regularly Scheduled Series,1,,M,2,Live,2000-04-10T04:00:00Z
178,The Impact of Epidemiology on Prostate Cancer Origin Progression,"The Impact of Epidemiology on Prostate Cancer Origin Progression Regularly Scheduled Series RSS Live   04/10/2000  2000  04  ",Regularly Scheduled Series,1,,M,2,Live,2000-04-10T04:00:00Z
179,"Faculty Development Course in End-of-Life Care""","Faculty Development Course in End-of-Life Care"" Regularly Scheduled Series RSS Live   04/11/2000  2000  04  ",Regularly Scheduled Series,1,,M,2,Live,2000-04-11T04:00:00Z
180,Ultra Rapid Opiate Detoxification,"Ultra Rapid Opiate Detoxification Regularly Scheduled Series RSS Live   04/12/2000  2000  04  ",Regularly Scheduled Series,1,,M,2,Live,2000-04-12T04:00:00Z
181,Colon Cancer/Possible Stomach Cancer,"Colon Cancer/Possible Stomach Cancer Regularly Scheduled Series RSS Live   04/12/2000  2000  04  ",Regularly Scheduled Series,1,,M,2,Live,2000-04-12T04:00:00Z
182,Palliative Medicine - Why Now?,"Palliative Medicine - Why Now? Regularly Scheduled Series RSS Live   04/12/2000  2000  04  ",Regularly Scheduled Series,1,,M,2,Live,2000-04-12T04:00:00Z
183,Idiosyncratic Drug Reactions,"Idiosyncratic Drug Reactions Regularly Scheduled Series RSS Live   04/12/2000  2000  04  ",Regularly Scheduled Series,1,,M,2,Live,2000-04-12T04:00:00Z
184,Visual Field Fascinomas,"Visual Field Fascinomas Regularly Scheduled Series RSS Live   04/12/2000  2000  04  ",Regularly Scheduled Series,1,,M,2,Live,2000-04-12T04:00:00Z
185,Combining Aesthetic Surgery with Reconstructive Surgery,"Combining Aesthetic Surgery with Reconstructive Surgery Regularly Scheduled Series RSS Live   04/12/2000  2000  04  ",Regularly Scheduled Series,1,,M,2,Live,2000-04-12T04:00:00Z
186,Interpersonal Psychotherapy,"Interpersonal Psychotherapy Regularly Scheduled Series RSS Live   04/12/2000  2000  04  ",Regularly Scheduled Series,1,,M,2,Live,2000-04-12T04:00:00Z
187,Psychopharmacology Update:  Varied Psychiatric Pharmaceuticals and Original Research,"Psychopharmacology Update:  Varied Psychiatric Pharmaceuticals and Original Research Regularly Scheduled Series RSS Live   04/12/2000  2000  04  ",Regularly Scheduled Series,1,,M,2,Live,2000-04-12T04:00:00Z
188,Surgical Grand Rounds,"Surgical Grand Rounds Regularly Scheduled Series RSS Live   04/12/2000  2000  04  ",Regularly Scheduled Series,1,,M,2,Live,2000-04-12T04:00:00Z
189,Hematology/Oncology Grand Rounds,"Hematology/Oncology Grand Rounds Regularly Scheduled Series RSS Live   04/14/2000  2000  04  ",Regularly Scheduled Series,1,,M,2,Live,2000-04-14T04:00:00Z
190,Electrical Stimulation for Swallowing Rehabilitation,"Electrical Stimulation for Swallowing Rehabilitation Regularly Scheduled Series RSS Live   04/14/2000  2000  04  ",Regularly Scheduled Series,1,,M,2,Live,2000-04-14T04:00:00Z
191,Current Concepts in Management of Slipped Capital Femoral Epiphysis in Children,"Current Concepts in Management of Slipped Capital Femoral Epiphysis in Children Regularly Scheduled Series RSS Live   04/15/2000  2000  04  ",Regularly Scheduled Series,1,,M,2,Live,2000-04-15T04:00:00Z
192,Childhood Glomerulopathies,"Childhood Glomerulopathies Regularly Scheduled Series RSS Live   04/17/2000  2000  04  ",Regularly Scheduled Series,1,,M,2,Live,2000-04-17T04:00:00Z
193,Anesthesia and Pain Management in Other Lands,"Anesthesia and Pain Management in Other Lands Regularly Scheduled Series RSS Live   04/19/2000  2000  04  ",Regularly Scheduled Series,1,,M,2,Live,2000-04-19T04:00:00Z
194,Medical and Surgical Management of Sinusitis,"Medical and Surgical Management of Sinusitis Regularly Scheduled Series RSS Live   04/19/2000  2000  04  ",Regularly Scheduled Series,1,,M,2,Live,2000-04-19T04:00:00Z
195,Genetic Syndromes,"Genetic Syndromes Regularly Scheduled Series RSS Live   04/19/2000  2000  04  ",Regularly Scheduled Series,1,,M,2,Live,2000-04-19T04:00:00Z
196,Management of Complications During Cataract Surgery,"Management of Complications During Cataract Surgery Regularly Scheduled Series RSS Live   04/19/2000  2000  04  ",Regularly Scheduled Series,1,,M,2,Live,2000-04-19T04:00:00Z
197,Bad Boys-Bad Men:  Confronting Antisocial Personality Disorder,"Bad Boys-Bad Men:  Confronting Antisocial Personality Disorder Regularly Scheduled Series RSS Live   04/19/2000  2000  04  ",Regularly Scheduled Series,1,,M,2,Live,2000-04-19T04:00:00Z
198,Surgical Grand Rounds,"Surgical Grand Rounds Regularly Scheduled Series RSS Live   04/19/2000  2000  04  ",Regularly Scheduled Series,1,,M,2,Live,2000-04-19T04:00:00Z
199,The Most Heterogeneous Neoplasia Syndrome,"The Most Heterogeneous Neoplasia Syndrome Regularly Scheduled Series RSS Live   04/19/2000  2000  04  ",Regularly Scheduled Series,1,,M,2,Live,2000-04-19T04:00:00Z
200,Hematology/Oncology Grand Rounds,"Hematology/Oncology Grand Rounds Regularly Scheduled Series RSS Live   04/21/2000  2000  04  ",Regularly Scheduled Series,1,,M,2,Live,2000-04-21T04:00:00Z
201,The Clinical Data Base: A tool for clinical service decision making,"The Clinical Data Base: A tool for clinical service decision making Regularly Scheduled Series RSS Live   04/21/2000  2000  04  ",Regularly Scheduled Series,1,,M,2,Live,2000-04-21T04:00:00Z
202,New Issues in Blood Bank,"New Issues in Blood Bank Regularly Scheduled Series RSS Live   04/24/2000  2000  04  ",Regularly Scheduled Series,1,,M,2,Live,2000-04-24T04:00:00Z
203,Systemic Lupus Erythematosus/Pulmonary Fibrosis,"Systemic Lupus Erythematosus/Pulmonary Fibrosis Regularly Scheduled Series RSS Live   04/25/2000  2000  04  ",Regularly Scheduled Series,1,,M,2,Live,2000-04-25T04:00:00Z
204,Pharmaco-Immunology - Shaping the Immune Response,"Pharmaco-Immunology - Shaping the Immune Response Regularly Scheduled Series RSS Live   04/26/2000  2000  04  ",Regularly Scheduled Series,1,,M,2,Live,2000-04-26T04:00:00Z
205,Uveitis Case Conference,"Uveitis Case Conference Regularly Scheduled Series RSS Live   04/26/2000  2000  04  ",Regularly Scheduled Series,1,,M,2,Live,2000-04-26T04:00:00Z
206,Management of Traumatic Nasal Injuries and Deformity,"Management of Traumatic Nasal Injuries and Deformity Regularly Scheduled Series RSS Live   04/26/2000  2000  04  ",Regularly Scheduled Series,1,,M,2,Live,2000-04-26T04:00:00Z
207,ADHD:  Neurobiologic Aspects to Consider for Treatment and Co-morbidity Considerations for Evaluatio,"ADHD:  Neurobiologic Aspects to Consider for Treatment and Co-morbidity Considerations for Evaluatio Regularly Scheduled Series RSS Live   04/26/2000  2000  04  ",Regularly Scheduled Series,1,,M,2,Live,2000-04-26T04:00:00Z
208,Neurocognition in Bipolar Disorder:  An fMRI Study,"Neurocognition in Bipolar Disorder:  An fMRI Study Regularly Scheduled Series RSS Live   04/26/2000  2000  04  ",Regularly Scheduled Series,1,,M,2,Live,2000-04-26T04:00:00Z
209,Surgical Grand Rounds,"Surgical Grand Rounds Regularly Scheduled Series RSS Live   04/26/2000  2000  04  ",Regularly Scheduled Series,1,,M,2,Live,2000-04-26T04:00:00Z
210,"Faculty Development Workshop Series, Session 1","Faculty Development Workshop Series, Session 1 Regularly Scheduled Series RSS Live   04/27/2000  2000  04  ",Regularly Scheduled Series,1,,M,2,Live,2000-04-27T04:00:00Z
211,Hematology/Oncology Grand Rounds,"Hematology/Oncology Grand Rounds Regularly Scheduled Series RSS Live   04/28/2000  2000  04  ",Regularly Scheduled Series,1,,M,2,Live,2000-04-28T04:00:00Z
212,C-Spine Injuries in the Athlete,"C-Spine Injuries in the Athlete Regularly Scheduled Series RSS Live   04/29/2000  2000  04  ",Regularly Scheduled Series,1,,M,2,Live,2000-04-29T04:00:00Z
213,Bile Acid Synthetic Defects and Liver Disease,"Bile Acid Synthetic Defects and Liver Disease Regularly Scheduled Series RSS Live   05/01/2000  2000  05  ",Regularly Scheduled Series,1,,M,2,Live,2000-05-01T04:00:00Z
214,Possible Neurofibroma,"Possible Neurofibroma Regularly Scheduled Series RSS Live   05/03/2000  2000  05  ",Regularly Scheduled Series,1,,M,2,Live,2000-05-03T04:00:00Z
215,Management of Heart Faliure - A Moving Target,"Management of Heart Faliure - A Moving Target Regularly Scheduled Series RSS Live   05/03/2000  2000  05  ",Regularly Scheduled Series,1,,M,2,Live,2000-05-03T04:00:00Z
216,The Ethics of Free,"The Ethics of Free Regularly Scheduled Series RSS Live   05/03/2000  2000  05  ",Regularly Scheduled Series,1,,M,2,Live,2000-05-03T04:00:00Z
217,Bloodborne Pathogens Lecture,"Bloodborne Pathogens Lecture Regularly Scheduled Series RSS Live   05/03/2000  2000  05  ",Regularly Scheduled Series,1,,M,2,Live,2000-05-03T04:00:00Z
218,Pediatric Tracheal Stenosis,"Pediatric Tracheal Stenosis Regularly Scheduled Series RSS Live   05/03/2000  2000  05  ",Regularly Scheduled Series,1,,M,2,Live,2000-05-03T04:00:00Z
219,Symptom Provocation and CNS Neurochemistry in Combat-Related Post-Traumatic Stress Disorder,"Symptom Provocation and CNS Neurochemistry in Combat-Related Post-Traumatic Stress Disorder Regularly Scheduled Series RSS Live   05/03/2000  2000  05  ",Regularly Scheduled Series,1,,M,2,Live,2000-05-03T04:00:00Z
220,Surgical Grand Rounds,"Surgical Grand Rounds Regularly Scheduled Series RSS Live   05/03/2000  2000  05  ",Regularly Scheduled Series,1,,M,2,Live,2000-05-03T04:00:00Z
221,Hematology/Oncology Grand Rounds,"Hematology/Oncology Grand Rounds Regularly Scheduled Series RSS Live   05/05/2000  2000  05  ",Regularly Scheduled Series,1,,M,2,Live,2000-05-05T04:00:00Z
222,The Art and Science of Thyroid Hormone Therapy,"The Art and Science of Thyroid Hormone Therapy Regularly Scheduled Series RSS Live   05/05/2000  2000  05  ",Regularly Scheduled Series,1,,M,2,Live,2000-05-05T04:00:00Z
223,Management of Massive Rotator Cuff Tear,"Management of Massive Rotator Cuff Tear Regularly Scheduled Series RSS Live   05/06/2000  2000  05  ",Regularly Scheduled Series,1,,M,2,Live,2000-05-06T04:00:00Z
224,Perinatal Cytomegalovirus Infections,"Perinatal Cytomegalovirus Infections Regularly Scheduled Series RSS Live   05/09/2000  2000  05  ",Regularly Scheduled Series,1,,M,2,Live,2000-05-09T04:00:00Z
225,Hemodynamic Monitoring: Concepts & Controversies,"Hemodynamic Monitoring: Concepts & Controversies Regularly Scheduled Series RSS Live   05/10/2000  2000  05  ",Regularly Scheduled Series,1,,M,2,Live,2000-05-10T04:00:00Z
226,Gastric Mult Lymphoma/Recurent Retroperitoneal Sarcoma,"Gastric Mult Lymphoma/Recurent Retroperitoneal Sarcoma Regularly Scheduled Series RSS Live   05/10/2000  2000  05  ",Regularly Scheduled Series,1,,M,2,Live,2000-05-10T04:00:00Z
227,University-wide CPC - Colorectal Cancer: Molecular Genetic and Therpeutic Advances,"University-wide CPC - Colorectal Cancer: Molecular Genetic and Therpeutic Advances Regularly Scheduled Series RSS Live   05/10/2000  2000  05  ",Regularly Scheduled Series,1,,M,2,Live,2000-05-10T04:00:00Z
228,Epilepsy in Women,"Epilepsy in Women Regularly Scheduled Series RSS Live   05/10/2000  2000  05  ",Regularly Scheduled Series,1,,M,2,Live,2000-05-10T04:00:00Z
229,Diagnostic Retinal Surgery in Posterior Vitreous,"Diagnostic Retinal Surgery in Posterior Vitreous Regularly Scheduled Series RSS Live   05/10/2000  2000  05  ",Regularly Scheduled Series,1,,M,2,Live,2000-05-10T04:00:00Z
230,Stress Molecules & the Limbic System,"Stress Molecules & the Limbic System Regularly Scheduled Series RSS Live   05/10/2000  2000  05  ",Regularly Scheduled Series,1,,M,2,Live,2000-05-10T04:00:00Z
231,Surgical Grand Rounds,"Surgical Grand Rounds Regularly Scheduled Series RSS Live   05/10/2000  2000  05  ",Regularly Scheduled Series,1,,M,2,Live,2000-05-10T04:00:00Z
232,Hematology/Oncology Grand Rounds,"Hematology/Oncology Grand Rounds Regularly Scheduled Series RSS Live   05/12/2000  2000  05  ",Regularly Scheduled Series,1,,M,2,Live,2000-05-12T04:00:00Z
233,Optimizing Precepting Clinic,"Optimizing Precepting Clinic Regularly Scheduled Series RSS Live   05/12/2000  2000  05  ",Regularly Scheduled Series,1,,M,2,Live,2000-05-12T04:00:00Z
234,Rheumatoid Arthritis and the Physiatrist,"Rheumatoid Arthritis and the Physiatrist Regularly Scheduled Series RSS Live   05/12/2000  2000  05  ",Regularly Scheduled Series,1,,M,2,Live,2000-05-12T04:00:00Z
235,The Infected Total Hip and Knee,"The Infected Total Hip and Knee Regularly Scheduled Series RSS Live   05/13/2000  2000  05  ",Regularly Scheduled Series,1,,M,2,Live,2000-05-13T04:00:00Z
236,New Classification of Gastric Cancer,"New Classification of Gastric Cancer Regularly Scheduled Series RSS Live   05/15/2000  2000  05  ",Regularly Scheduled Series,1,,M,2,Live,2000-05-15T04:00:00Z
237,Tracheoesophageal Fistula in Infants,"Tracheoesophageal Fistula in Infants Regularly Scheduled Series RSS Live   05/17/2000  2000  05  ",Regularly Scheduled Series,1,,M,2,Live,2000-05-17T04:00:00Z
238,Recurrent Retroperitoneal Sarcoma,"Recurrent Retroperitoneal Sarcoma Regularly Scheduled Series RSS Live   05/17/2000  2000  05  ",Regularly Scheduled Series,1,,M,2,Live,2000-05-17T04:00:00Z
239,Supportive Care in Cancer Patients Neutropenic Fever,"Supportive Care in Cancer Patients Neutropenic Fever Regularly Scheduled Series RSS Live   05/17/2000  2000  05  ",Regularly Scheduled Series,1,,M,2,Live,2000-05-17T04:00:00Z
240,Update on Hepatitus C Guidelines and New Modalities,"Update on Hepatitus C Guidelines and New Modalities Regularly Scheduled Series RSS Live   05/17/2000  2000  05  ",Regularly Scheduled Series,1,,M,2,Live,2000-05-17T04:00:00Z
241,Laterlizing Signs in Epileptic Seizures,"Laterlizing Signs in Epileptic Seizures Regularly Scheduled Series RSS Live   05/17/2000  2000  05  ",Regularly Scheduled Series,1,,M,2,Live,2000-05-17T04:00:00Z
242,Vitreoretinal Disease Conference,"Vitreoretinal Disease Conference Regularly Scheduled Series RSS Live   05/17/2000  2000  05  ",Regularly Scheduled Series,1,,M,2,Live,2000-05-17T04:00:00Z
243,Surgical Grand Rounds,"Surgical Grand Rounds Regularly Scheduled Series RSS Live   05/17/2000  2000  05  ",Regularly Scheduled Series,1,,M,2,Live,2000-05-17T04:00:00Z
244,Individualizing HRT: The Role of Transdermal Therapy,"Individualizing HRT: The Role of Transdermal Therapy Regularly Scheduled Series RSS Live   05/18/2000  2000  05  ",Regularly Scheduled Series,1,,M,2,Live,2000-05-18T04:00:00Z
245,Current Nomenclature/Classification of Gastritis and Clinical Implications of Your Diagnosis,"Current Nomenclature/Classification of Gastritis and Clinical Implications of Your Diagnosis Regularly Scheduled Series RSS Live   05/18/2000  2000  05  ",Regularly Scheduled Series,1,,M,2,Live,2000-05-18T04:00:00Z
246,Hematology/Oncology Grand Rounds,"Hematology/Oncology Grand Rounds Regularly Scheduled Series RSS Live   05/19/2000  2000  05  ",Regularly Scheduled Series,1,,M,2,Live,2000-05-19T04:00:00Z
247,Health Status and Utility Assessment  in Adolescents with Cystic Fibrosis,"Health Status and Utility Assessment  in Adolescents with Cystic Fibrosis Regularly Scheduled Series RSS Live   05/19/2000  2000  05  ",Regularly Scheduled Series,1,,M,2,Live,2000-05-19T04:00:00Z
248,Restoration of Tetraplegic Hand Function Using a FES Neuroprothesis,"Restoration of Tetraplegic Hand Function Using a FES Neuroprothesis Regularly Scheduled Series RSS Live   05/19/2000  2000  05  ",Regularly Scheduled Series,1,,M,2,Live,2000-05-19T04:00:00Z
249,Treatment of Fractures with Intramedullary Nailing,"Treatment of Fractures with Intramedullary Nailing Regularly Scheduled Series RSS Live   05/20/2000  2000  05  ",Regularly Scheduled Series,1,,M,2,Live,2000-05-20T04:00:00Z
250,Emerging Complications in HIV: Where do We Go from Here?,"Emerging Complications in HIV: Where do We Go from Here? Regularly Scheduled Series RSS Live   05/21/2000  2000  05  ",Regularly Scheduled Series,1,,M,2,Live,2000-05-21T04:00:00Z
251,Hyperammonemia,"Hyperammonemia Regularly Scheduled Series RSS Live   05/23/2000  2000  05  ",Regularly Scheduled Series,1,,M,2,Live,2000-05-23T04:00:00Z
252,Monitoring of Heparin Administration,"Monitoring of Heparin Administration Regularly Scheduled Series RSS Live   05/24/2000  2000  05  ",Regularly Scheduled Series,1,,M,2,Live,2000-05-24T04:00:00Z
253,Thymoma/Perianal Bowman's Disease/Breast Cancer/Rectal Cancer,"Thymoma/Perianal Bowman's Disease/Breast Cancer/Rectal Cancer Regularly Scheduled Series RSS Live   05/24/2000  2000  05  ",Regularly Scheduled Series,1,,M,2,Live,2000-05-24T04:00:00Z
254,Update of the Renin-Angiotensin System,"Update of the Renin-Angiotensin System Regularly Scheduled Series RSS Live   05/24/2000  2000  05  ",Regularly Scheduled Series,1,,M,2,Live,2000-05-24T04:00:00Z
255,Neuro-hemataology:  The Breakdown of the Blood Brain Barrier,"Neuro-hemataology:  The Breakdown of the Blood Brain Barrier Regularly Scheduled Series RSS Live   05/24/2000  2000  05  ",Regularly Scheduled Series,1,,M,2,Live,2000-05-24T04:00:00Z
256,A-Scan and IOL Calculations,"A-Scan and IOL Calculations Regularly Scheduled Series RSS Live   05/24/2000  2000  05  ",Regularly Scheduled Series,1,,M,2,Live,2000-05-24T04:00:00Z
257,Thanatopsis,"Thanatopsis Regularly Scheduled Series RSS Live   05/24/2000  2000  05  ",Regularly Scheduled Series,1,,M,2,Live,2000-05-24T04:00:00Z
258,From Theory-Centered to Patient-Centered Therapeutic Process,"From Theory-Centered to Patient-Centered Therapeutic Process Regularly Scheduled Series RSS Live   05/24/2000  2000  05  ",Regularly Scheduled Series,1,,M,2,Live,2000-05-24T04:00:00Z
259,Surgical Grand Rounds,"Surgical Grand Rounds Regularly Scheduled Series RSS Live   05/24/2000  2000  05  ",Regularly Scheduled Series,1,,M,2,Live,2000-05-24T04:00:00Z
260,Hematology/Oncology Grand Rounds,"Hematology/Oncology Grand Rounds Regularly Scheduled Series RSS Live   05/26/2000  2000  05  ",Regularly Scheduled Series,1,,M,2,Live,2000-05-26T04:00:00Z
261,Intravenous IqG in Guillain-Barre Syndrome and Rehabilitation Outcome,"Intravenous IqG in Guillain-Barre Syndrome and Rehabilitation Outcome Regularly Scheduled Series RSS Live   05/26/2000  2000  05  ",Regularly Scheduled Series,1,,M,2,Live,2000-05-26T04:00:00Z
262,"Critical Assessment of Clinical Trials, Meta-analysis & Economic Evaluations","Critical Assessment of Clinical Trials, Meta-analysis & Economic Evaluations Regularly Scheduled Series RSS Live   05/31/2000  2000  05  ",Regularly Scheduled Series,1,,M,2,Live,2000-05-31T04:00:00Z
263,New Developments in Cushing's Disease,"New Developments in Cushing's Disease Regularly Scheduled Series RSS Live   05/31/2000  2000  05  ",Regularly Scheduled Series,1,,M,2,Live,2000-05-31T04:00:00Z
264,Cataract Surgery Case Conference,"Cataract Surgery Case Conference Regularly Scheduled Series RSS Live   05/31/2000  2000  05  ",Regularly Scheduled Series,1,,M,2,Live,2000-05-31T04:00:00Z
265,"Cognitive Behavior Therapy for Panic Disorder-Theory, Methods and Outcome","Cognitive Behavior Therapy for Panic Disorder-Theory, Methods and Outcome Regularly Scheduled Series RSS Live   05/31/2000  2000  05  ",Regularly Scheduled Series,1,,M,2,Live,2000-05-31T04:00:00Z
266,Surgical Grand Rounds,"Surgical Grand Rounds Regularly Scheduled Series RSS Live   05/31/2000  2000  05  ",Regularly Scheduled Series,1,,M,2,Live,2000-05-31T04:00:00Z
267,"Chaos, Complexity, and Case Studies: The Prevention & Competing Demands in Primary Care Study","Chaos, Complexity, and Case Studies: The Prevention & Competing Demands in Primary Care Study Regularly Scheduled Series RSS Live   06/02/2000  2000  06  ",Regularly Scheduled Series,1,,M,2,Live,2000-06-02T04:00:00Z
268,Hematology/Oncology Grand Rounds,"Hematology/Oncology Grand Rounds Regularly Scheduled Series RSS Live   06/02/2000  2000  06  ",Regularly Scheduled Series,1,,M,2,Live,2000-06-02T04:00:00Z
269,Central Dysautonomia,"Central Dysautonomia Regularly Scheduled Series RSS Live   06/02/2000  2000  06  ",Regularly Scheduled Series,1,,M,2,Live,2000-06-02T04:00:00Z
270,Management of Femoral Neck Fractures,"Management of Femoral Neck Fractures Regularly Scheduled Series RSS Live   06/03/2000  2000  06  ",Regularly Scheduled Series,1,,M,2,Live,2000-06-03T04:00:00Z
271,Surgical Grand Rounds,"Surgical Grand Rounds Regularly Scheduled Series RSS Live   06/05/2000  2000  06  ",Regularly Scheduled Series,1,,M,2,Live,2000-06-05T04:00:00Z
272,Esthesioneuroblastoma,"Esthesioneuroblastoma Regularly Scheduled Series RSS Live   06/07/2000  2000  06  ",Regularly Scheduled Series,1,,M,2,Live,2000-06-07T04:00:00Z
273,Special Problems in Managing Women with Epilepsy,"Special Problems in Managing Women with Epilepsy Regularly Scheduled Series RSS Live   06/07/2000  2000  06  ",Regularly Scheduled Series,1,,M,2,Live,2000-06-07T04:00:00Z
274,Ocular Foreign Bodies,"Ocular Foreign Bodies Regularly Scheduled Series RSS Live   06/07/2000  2000  06  ",Regularly Scheduled Series,1,,M,2,Live,2000-06-07T04:00:00Z
275,The Evaluation and Management of Dysgeusia,"The Evaluation and Management of Dysgeusia Regularly Scheduled Series RSS Live   06/07/2000  2000  06  ",Regularly Scheduled Series,1,,M,2,Live,2000-06-07T04:00:00Z
276,"Death, Depression and Heart Disease","Death, Depression and Heart Disease Regularly Scheduled Series RSS Live   06/07/2000  2000  06  ",Regularly Scheduled Series,1,,M,2,Live,2000-06-07T04:00:00Z
277,Vitamins in Disease Prevention:  A Review of the Evidence,"Vitamins in Disease Prevention:  A Review of the Evidence Regularly Scheduled Series RSS Live   06/07/2000  2000  06  ",Regularly Scheduled Series,1,,M,2,Live,2000-06-07T04:00:00Z
278,Hematology/Oncology Grand Rounds,"Hematology/Oncology Grand Rounds Regularly Scheduled Series RSS Live   06/09/2000  2000  06  ",Regularly Scheduled Series,1,,M,2,Live,2000-06-09T04:00:00Z
279,Continuous Intrahecal Baclofen Pump vs. Selective Dorsal Rhizotomy for the Treatment of Cerebral Pal,"Continuous Intrahecal Baclofen Pump vs. Selective Dorsal Rhizotomy for the Treatment of Cerebral Pal Regularly Scheduled Series RSS Live   06/09/2000  2000  06  ",Regularly Scheduled Series,1,,M,2,Live,2000-06-09T04:00:00Z
280,Evidence Based Medicine and Neural Blockade,"Evidence Based Medicine and Neural Blockade Regularly Scheduled Series RSS Live   06/14/2000  2000  06  ",Regularly Scheduled Series,1,,M,2,Live,2000-06-14T04:00:00Z
281,Fellows Grand  Rounds and Poster Displays,"Fellows Grand  Rounds and Poster Displays Regularly Scheduled Series RSS Live   06/14/2000  2000  06  ",Regularly Scheduled Series,1,,M,2,Live,2000-06-14T04:00:00Z
282,An Unusual Movement Disorder,"An Unusual Movement Disorder Regularly Scheduled Series RSS Live   06/14/2000  2000  06  ",Regularly Scheduled Series,1,,M,2,Live,2000-06-14T04:00:00Z
283,A Flexible Approach to the Pediatric Airway,"A Flexible Approach to the Pediatric Airway Regularly Scheduled Series RSS Live   06/14/2000  2000  06  ",Regularly Scheduled Series,1,,M,2,Live,2000-06-14T04:00:00Z
284,Omega-3 Fatty Acids & Other Novel Treatments for Bipolar Disorder,"Omega-3 Fatty Acids & Other Novel Treatments for Bipolar Disorder Regularly Scheduled Series RSS Live   06/14/2000  2000  06  ",Regularly Scheduled Series,1,,M,2,Live,2000-06-14T04:00:00Z
285,Surgical Grand Rounds,"Surgical Grand Rounds Regularly Scheduled Series RSS Live   06/14/2000  2000  06  ",Regularly Scheduled Series,1,,M,2,Live,2000-06-14T04:00:00Z
286,Hematology/Oncology Grand Rounds,"Hematology/Oncology Grand Rounds Regularly Scheduled Series RSS Live   06/16/2000  2000  06  ",Regularly Scheduled Series,1,,M,2,Live,2000-06-16T04:00:00Z
287,Pulmonary 2000,"Pulmonary 2000 Regularly Scheduled Series RSS Live All grand rounds for 2000  06/19/2000  2000  06  ",Regularly Scheduled Series,1,All grand rounds for 2000,M,2,Live,2000-06-19T04:00:00Z
288,The Role of Surfactant Protein-D in Acute Lung Injury,"The Role of Surfactant Protein-D in Acute Lung Injury Regularly Scheduled Series RSS Live   06/19/2000  2000  06  ",Regularly Scheduled Series,1,,M,2,Live,2000-06-19T04:00:00Z
289,Adrenal Mass/Rectal Cancer,"Adrenal Mass/Rectal Cancer Regularly Scheduled Series RSS Live   06/21/2000  2000  06  ",Regularly Scheduled Series,1,,M,2,Live,2000-06-21T04:00:00Z
290,"Faculty Development Workshop Series, Session 2","Faculty Development Workshop Series, Session 2 Regularly Scheduled Series RSS Live   06/21/2000  2000  06  ",Regularly Scheduled Series,1,,M,2,Live,2000-06-21T04:00:00Z
291,Progression of Chronic Renal Failure: Use of Converting Enzyme Inhibitors(CEI) vs. Angiotensin Recep,"Progression of Chronic Renal Failure: Use of Converting Enzyme Inhibitors(CEI) vs. Angiotensin Recep Regularly Scheduled Series RSS Live   06/21/2000  2000  06  ",Regularly Scheduled Series,1,,M,2,Live,2000-06-21T04:00:00Z
292,Paraneoplastic Syndrome,"Paraneoplastic Syndrome Regularly Scheduled Series RSS Live   06/21/2000  2000  06  ",Regularly Scheduled Series,1,,M,2,Live,2000-06-21T04:00:00Z
293,Iris Cysts,"Iris Cysts Regularly Scheduled Series RSS Live   06/21/2000  2000  06  ",Regularly Scheduled Series,1,,M,2,Live,2000-06-21T04:00:00Z
294,Some Neurobiological Aspects of Psychotherapy,"Some Neurobiological Aspects of Psychotherapy Regularly Scheduled Series RSS Live   06/21/2000  2000  06  ",Regularly Scheduled Series,1,,M,2,Live,2000-06-21T04:00:00Z
295,Some Neurobiological Aspects of Psycotherapy,"Some Neurobiological Aspects of Psycotherapy Regularly Scheduled Series RSS Live   06/21/2000  2000  06  ",Regularly Scheduled Series,1,,M,2,Live,2000-06-21T04:00:00Z
296,Surgical Grand Rounds,"Surgical Grand Rounds Regularly Scheduled Series RSS Live   06/21/2000  2000  06  ",Regularly Scheduled Series,1,,M,2,Live,2000-06-21T04:00:00Z
297,Hematology/Oncology Grand Rounds,"Hematology/Oncology Grand Rounds Regularly Scheduled Series RSS Live   06/23/2000  2000  06  ",Regularly Scheduled Series,1,,M,2,Live,2000-06-23T04:00:00Z
298,Chronic Cough in Children,"Chronic Cough in Children Regularly Scheduled Series RSS Live   06/28/2000  2000  06  ",Regularly Scheduled Series,1,,M,2,Live,2000-06-28T04:00:00Z
299,Inhibition of Cytokine Function - Why and How,"Inhibition of Cytokine Function - Why and How Regularly Scheduled Series RSS Live   06/28/2000  2000  06  ",Regularly Scheduled Series,1,,M,2,Live,2000-06-28T04:00:00Z
300,Beyond Thrombolysis,"Beyond Thrombolysis Regularly Scheduled Series RSS Live   06/28/2000  2000  06  ",Regularly Scheduled Series,1,,M,2,Live,2000-06-28T04:00:00Z
301,Corneal Dystrophies,"Corneal Dystrophies Regularly Scheduled Series RSS Live   06/28/2000  2000  06  ",Regularly Scheduled Series,1,,M,2,Live,2000-06-28T04:00:00Z
302,Hematology/Oncology Grand Rounds,"Hematology/Oncology Grand Rounds Regularly Scheduled Series RSS Live   06/30/2000  2000  06  ",Regularly Scheduled Series,1,,M,2,Live,2000-06-30T04:00:00Z
303,Unstable Anigma,"Unstable Anigma Regularly Scheduled Series RSS Live   07/05/2000  2000  07  ",Regularly Scheduled Series,1,,M,2,Live,2000-07-05T04:00:00Z
304,Hyponatremia: It's Not a Mystery,"Hyponatremia: It's Not a Mystery Regularly Scheduled Series RSS Live   07/05/2000  2000  07  ",Regularly Scheduled Series,1,,M,2,Live,2000-07-05T04:00:00Z
305,"""ABC"" Therapies Immunomodulation in MS","""ABC"" Therapies Immunomodulation in MS Regularly Scheduled Series RSS Live   07/05/2000  2000  07  ",Regularly Scheduled Series,1,,M,2,Live,2000-07-05T04:00:00Z
306,Update on Otosclerosis,"Update on Otosclerosis Regularly Scheduled Series RSS Live   07/05/2000  2000  07  ",Regularly Scheduled Series,1,,M,2,Live,2000-07-05T04:00:00Z
307,Asthma Update,"Asthma Update Regularly Scheduled Series RSS Live   07/07/2000  2000  07  ",Regularly Scheduled Series,1,,M,2,Live,2000-07-07T04:00:00Z
308,Surgical Grand Rounds,"Surgical Grand Rounds Regularly Scheduled Series RSS Live   07/07/2000  2000  07  ",Regularly Scheduled Series,1,,M,2,Live,2000-07-07T04:00:00Z
309,Disease of the Month Update 2000,"Disease of the Month Update 2000 Regularly Scheduled Series RSS Live All grand rounds for 2000  07/11/2000  2000  07  ",Regularly Scheduled Series,1,All grand rounds for 2000,M,2,Live,2000-07-11T04:00:00Z
310,Neonatal Brain Pathology,"Neonatal Brain Pathology Regularly Scheduled Series RSS Live   07/11/2000  2000  07  ",Regularly Scheduled Series,1,,M,2,Live,2000-07-11T04:00:00Z
311,Organ Donation & Transplantation,"Organ Donation & Transplantation Regularly Scheduled Series RSS Live   07/12/2000  2000  07  ",Regularly Scheduled Series,1,,M,2,Live,2000-07-12T04:00:00Z
312,Speeding Up Your Diagnosis: New Nuclear Medicine Approaches,"Speeding Up Your Diagnosis: New Nuclear Medicine Approaches Regularly Scheduled Series RSS Live   07/12/2000  2000  07  ",Regularly Scheduled Series,1,,M,2,Live,2000-07-12T04:00:00Z
313,C-T DentaScans for Diagnosis of Oral Pathology and Jaw Reconstruction,"C-T DentaScans for Diagnosis of Oral Pathology and Jaw Reconstruction Regularly Scheduled Series RSS Live   07/12/2000  2000  07  ",Regularly Scheduled Series,1,,M,2,Live,2000-07-12T04:00:00Z
314,Complications of Regional Anesthesia,"Complications of Regional Anesthesia Regularly Scheduled Series RSS Live   07/19/2000  2000  07  ",Regularly Scheduled Series,1,,M,2,Live,2000-07-19T04:00:00Z
315,Pulmonary Embolism: P.E. or not P.E.,"Pulmonary Embolism: P.E. or not P.E. Regularly Scheduled Series RSS Live   07/19/2000  2000  07  ",Regularly Scheduled Series,1,,M,2,Live,2000-07-19T04:00:00Z
316,Left Lower Lobe Carcinoid Tumor,"Left Lower Lobe Carcinoid Tumor Regularly Scheduled Series RSS Live   07/19/2000  2000  07  ",Regularly Scheduled Series,1,,M,2,Live,2000-07-19T04:00:00Z
317,Novel Therapies for Inflammatory Bowel Disease,"Novel Therapies for Inflammatory Bowel Disease Regularly Scheduled Series RSS Live   07/19/2000  2000  07  ",Regularly Scheduled Series,1,,M,2,Live,2000-07-19T04:00:00Z
318,Congenital Muscular Dystrophy,"Congenital Muscular Dystrophy Regularly Scheduled Series RSS Live   07/19/2000  2000  07  ",Regularly Scheduled Series,1,,M,2,Live,2000-07-19T04:00:00Z
319,Cost Effective Medicine in Otolaryngology,"Cost Effective Medicine in Otolaryngology Regularly Scheduled Series RSS Live   07/19/2000  2000  07  ",Regularly Scheduled Series,1,,M,2,Live,2000-07-19T04:00:00Z
320,Paediatric Sinus Surgery,"Paediatric Sinus Surgery Regularly Scheduled Series RSS Live   07/19/2000  2000  07  ",Regularly Scheduled Series,1,,M,2,Live,2000-07-19T04:00:00Z
321,Surgical Grand Rounds,"Surgical Grand Rounds Regularly Scheduled Series RSS Live   07/19/2000  2000  07  ",Regularly Scheduled Series,1,,M,2,Live,2000-07-19T04:00:00Z
322,Bagpiping:  A Sign of Impairment or a Cure for Stress,"Bagpiping:  A Sign of Impairment or a Cure for Stress Regularly Scheduled Series RSS Live   07/21/2000  2000  07  ",Regularly Scheduled Series,1,,M,2,Live,2000-07-21T04:00:00Z
323,Living Donor Liver Transplantation,"Living Donor Liver Transplantation Regularly Scheduled Series RSS Live   07/26/2000  2000  07  ",Regularly Scheduled Series,1,,M,2,Live,2000-07-26T04:00:00Z
324,Seminoma of the Left Testis,"Seminoma of the Left Testis Regularly Scheduled Series RSS Live   07/26/2000  2000  07  ",Regularly Scheduled Series,1,,M,2,Live,2000-07-26T04:00:00Z
325,The Pharmacogenomics of B2-adrenergic Receptors and Asthma,"The Pharmacogenomics of B2-adrenergic Receptors and Asthma Regularly Scheduled Series RSS Live   07/26/2000  2000  07  ",Regularly Scheduled Series,1,,M,2,Live,2000-07-26T04:00:00Z
326,Drake Center 2000,"Drake Center 2000 Regularly Scheduled Series RSS Live All grand rounds for 2000  08/01/2000  2000  08  ",Regularly Scheduled Series,1,All grand rounds for 2000,M,2,Live,2000-08-01T04:00:00Z
327,Summer Series - Enhancing the Quality of Life for Elderly Coping with Low Vision,"Summer Series - Enhancing the Quality of Life for Elderly Coping with Low Vision Regularly Scheduled Series RSS Live   08/01/2000  2000  08  ",Regularly Scheduled Series,1,,M,2,Live,2000-08-01T04:00:00Z
328,Esophageal Cancer,"Esophageal Cancer Regularly Scheduled Series RSS Live   08/02/2000  2000  08  ",Regularly Scheduled Series,1,,M,2,Live,2000-08-02T04:00:00Z
329,Giant Cell Myocarditis,"Giant Cell Myocarditis Regularly Scheduled Series RSS Live   08/02/2000  2000  08  ",Regularly Scheduled Series,1,,M,2,Live,2000-08-02T04:00:00Z
330,Neuro/Oncology Tumor Board 2000,"Neuro/Oncology Tumor Board 2000 Regularly Scheduled Series RSS Live All grand rounds for 2000  08/02/2000  2000  08  ",Regularly Scheduled Series,1,All grand rounds for 2000,M,2,Live,2000-08-02T04:00:00Z
331,Neuro-Oncology Tumor Board (1.50),"Neuro-Oncology Tumor Board (1.50) Regularly Scheduled Series RSS Live   08/02/2000  2000  08  ",Regularly Scheduled Series,1,,M,2,Live,2000-08-02T04:00:00Z
332,Carnitine in Neurological Diseases,"Carnitine in Neurological Diseases Regularly Scheduled Series RSS Live   08/02/2000  2000  08  ",Regularly Scheduled Series,1,,M,2,Live,2000-08-02T04:00:00Z
333,Nasal Obstruction and Sleep Disordered Breathing,"Nasal Obstruction and Sleep Disordered Breathing Regularly Scheduled Series RSS Live   08/02/2000  2000  08  ",Regularly Scheduled Series,1,,M,2,Live,2000-08-02T04:00:00Z
334,Current Approaches to Lung Cancer,"Current Approaches to Lung Cancer Regularly Scheduled Series RSS Live   08/09/2000  2000  08  ",Regularly Scheduled Series,1,,M,2,Live,2000-08-09T04:00:00Z
335,Surgical Management of Burn Wounds,"Surgical Management of Burn Wounds Regularly Scheduled Series RSS Live   08/09/2000  2000  08  ",Regularly Scheduled Series,1,,M,2,Live,2000-08-09T04:00:00Z
336,Salmonella: Islands in the Genome,"Salmonella: Islands in the Genome Regularly Scheduled Series RSS Live   08/09/2000  2000  08  ",Regularly Scheduled Series,1,,M,2,Live,2000-08-09T04:00:00Z
337,Multidisciplinary Solid Tumor Board 2000,"Multidisciplinary Solid Tumor Board 2000 Regularly Scheduled Series RSS Live All grand rounds for 2000  08/09/2000  2000  08  ",Regularly Scheduled Series,1,All grand rounds for 2000,M,2,Live,2000-08-09T04:00:00Z
338,Metastatic Breast Cancer,"Metastatic Breast Cancer Regularly Scheduled Series RSS Live   08/09/2000  2000  08  ",Regularly Scheduled Series,1,,M,2,Live,2000-08-09T04:00:00Z
339,Neuro-Oncology Tumor Board (1.50),"Neuro-Oncology Tumor Board (1.50) Regularly Scheduled Series RSS Live   08/09/2000  2000  08  ",Regularly Scheduled Series,1,,M,2,Live,2000-08-09T04:00:00Z
340,Transcranial Doppler: From Birth to Earth,"Transcranial Doppler: From Birth to Earth Regularly Scheduled Series RSS Live   08/09/2000  2000  08  ",Regularly Scheduled Series,1,,M,2,Live,2000-08-09T04:00:00Z
341,Unusual Complication of Otitis Media,"Unusual Complication of Otitis Media Regularly Scheduled Series RSS Live   08/09/2000  2000  08  ",Regularly Scheduled Series,1,,M,2,Live,2000-08-09T04:00:00Z
342,Recent Advances in Obstetrics and Gynecology (5.00),"Recent Advances in Obstetrics and Gynecology (5.00) Regularly Scheduled Series RSS Live   08/11/2000  2000  08  ",Regularly Scheduled Series,1,,M,2,Live,2000-08-11T04:00:00Z
343,Recent Advances in Obstetrics and Gynecology (5.00),"Recent Advances in Obstetrics and Gynecology (5.00) Regularly Scheduled Series RSS Live   08/12/2000  2000  08  ",Regularly Scheduled Series,1,,M,2,Live,2000-08-12T04:00:00Z
344,Recent Advances in Obstetrics and Gynecology (5.00),"Recent Advances in Obstetrics and Gynecology (5.00) Regularly Scheduled Series RSS Live   08/13/2000  2000  08  ",Regularly Scheduled Series,1,,M,2,Live,2000-08-13T04:00:00Z
345,Recent Advances in Obstetrics and Gynecology (5.00),"Recent Advances in Obstetrics and Gynecology (5.00) Regularly Scheduled Series RSS Live   08/14/2000  2000  08  ",Regularly Scheduled Series,1,,M,2,Live,2000-08-14T04:00:00Z
346,Summer Series - The Role of Rehabilitation Medicine in Enhancement of Mobility and Balance,"Summer Series - The Role of Rehabilitation Medicine in Enhancement of Mobility and Balance Regularly Scheduled Series RSS Live   08/15/2000  2000  08  ",Regularly Scheduled Series,1,,M,2,Live,2000-08-15T04:00:00Z
347,Diagnosis and Management of Benign Anorectal Disorders,"Diagnosis and Management of Benign Anorectal Disorders Regularly Scheduled Series RSS Live   08/16/2000  2000  08  ",Regularly Scheduled Series,1,,M,2,Live,2000-08-16T04:00:00Z
348,Anaphylaxis: An Experimental Approach,"Anaphylaxis: An Experimental Approach Regularly Scheduled Series RSS Live   08/16/2000  2000  08  ",Regularly Scheduled Series,1,,M,2,Live,2000-08-16T04:00:00Z
349,Double Vision:  Diagnosis and Evaluation,"Double Vision:  Diagnosis and Evaluation Regularly Scheduled Series RSS Live   08/16/2000  2000  08  ",Regularly Scheduled Series,1,,M,2,Live,2000-08-16T04:00:00Z
350,"The Piezoelectric Cochlear Implant:  Concept, Feasibility, Challenges and Issues","The Piezoelectric Cochlear Implant:  Concept, Feasibility, Challenges and Issues Regularly Scheduled Series RSS Live   08/16/2000  2000  08  ",Regularly Scheduled Series,1,,M,2,Live,2000-08-16T04:00:00Z
351,Modes of Fetal Death,"Modes of Fetal Death Regularly Scheduled Series RSS Live   08/22/2000  2000  08  ",Regularly Scheduled Series,1,,M,2,Live,2000-08-22T04:00:00Z
352,Summer Series - The Grit and Grace of Caregiving,"Summer Series - The Grit and Grace of Caregiving Regularly Scheduled Series RSS Live   08/22/2000  2000  08  ",Regularly Scheduled Series,1,,M,2,Live,2000-08-22T04:00:00Z
353,Organ Donation,"Organ Donation Regularly Scheduled Series RSS Live   08/23/2000  2000  08  ",Regularly Scheduled Series,1,,M,2,Live,2000-08-23T04:00:00Z
354,Multi-Lymphoma of Stomach/Unknown Primary/Anal Cancer,"Multi-Lymphoma of Stomach/Unknown Primary/Anal Cancer Regularly Scheduled Series RSS Live   08/23/2000  2000  08  ",Regularly Scheduled Series,1,,M,2,Live,2000-08-23T04:00:00Z
355,"Non Small-cell Lung Cancer: You've Come a Long Way, Baby!","Non Small-cell Lung Cancer: You've Come a Long Way, Baby! Regularly Scheduled Series RSS Live   08/23/2000  2000  08  ",Regularly Scheduled Series,1,,M,2,Live,2000-08-23T04:00:00Z
356,Neuro-Oncology Tumor Board (1.50),"Neuro-Oncology Tumor Board (1.50) Regularly Scheduled Series RSS Live   08/23/2000  2000  08  ",Regularly Scheduled Series,1,,M,2,Live,2000-08-23T04:00:00Z
357,Clinical Outcomes Research-Focus on Epilepsy,"Clinical Outcomes Research-Focus on Epilepsy Regularly Scheduled Series RSS Live   08/23/2000  2000  08  ",Regularly Scheduled Series,1,,M,2,Live,2000-08-23T04:00:00Z
358,Summer Series - Newer Approaches in Prevention and Treatment of Osteoporosis,"Summer Series - Newer Approaches in Prevention and Treatment of Osteoporosis Regularly Scheduled Series RSS Live   08/29/2000  2000  08  ",Regularly Scheduled Series,1,,M,2,Live,2000-08-29T04:00:00Z
359,Preoperative assessment and Anesthetic Management of the Single Ventricle Patient,"Preoperative assessment and Anesthetic Management of the Single Ventricle Patient Regularly Scheduled Series RSS Live   08/30/2000  2000  08  ",Regularly Scheduled Series,1,,M,2,Live,2000-08-30T04:00:00Z
360,Uterine Sarcoma,"Uterine Sarcoma Regularly Scheduled Series RSS Live   08/30/2000  2000  08  ",Regularly Scheduled Series,1,,M,2,Live,2000-08-30T04:00:00Z
361,Heart Failure Research in the Setting of Acedemia and Community Health Center Collaboratives,"Heart Failure Research in the Setting of Acedemia and Community Health Center Collaboratives Regularly Scheduled Series RSS Live   08/30/2000  2000  08  ",Regularly Scheduled Series,1,,M,2,Live,2000-08-30T04:00:00Z
362,The Care of Older Persons with Diabetes:  Speciality Differences and Patient Preferences,"The Care of Older Persons with Diabetes:  Speciality Differences and Patient Preferences Regularly Scheduled Series RSS Live   08/30/2000  2000  08  ",Regularly Scheduled Series,1,,M,2,Live,2000-08-30T04:00:00Z
363,Current Information of Pediatric Subglottic Stenosis,"Current Information of Pediatric Subglottic Stenosis Regularly Scheduled Series RSS Live   08/30/2000  2000  08  ",Regularly Scheduled Series,1,,M,2,Live,2000-08-30T04:00:00Z
364,Building Community-Based Research Partnerships: The Midwest Clinicians Network-University of Chicago,"Building Community-Based Research Partnerships: The Midwest Clinicians Network-University of Chicago Regularly Scheduled Series RSS Live   08/31/2000  2000  08  ",Regularly Scheduled Series,1,,M,2,Live,2000-08-31T04:00:00Z
365,Radiation Safety,"Radiation Safety Regularly Scheduled Series RSS Live   09/06/2000  2000  09  ",Regularly Scheduled Series,1,,M,2,Live,2000-09-06T04:00:00Z
366,Kaposi's Sarcoma,"Kaposi's Sarcoma Regularly Scheduled Series RSS Live   09/06/2000  2000  09  ",Regularly Scheduled Series,1,,M,2,Live,2000-09-06T04:00:00Z
367,Hypertension: Genes and Salt,"Hypertension: Genes and Salt Regularly Scheduled Series RSS Live   09/06/2000  2000  09  ",Regularly Scheduled Series,1,,M,2,Live,2000-09-06T04:00:00Z
368,"When in Doubt, Don't Get an EEG:  The Clinical Utility in Children of Interictal EEG Under Condition","When in Doubt, Don't Get an EEG:  The Clinical Utility in Children of Interictal EEG Under Condition Regularly Scheduled Series RSS Live   09/06/2000  2000  09  ",Regularly Scheduled Series,1,,M,2,Live,2000-09-06T04:00:00Z
369,Orbital Disease and Plastic Surgery Case Conference,"Orbital Disease and Plastic Surgery Case Conference Regularly Scheduled Series RSS Live   09/06/2000  2000  09  ",Regularly Scheduled Series,1,,M,2,Live,2000-09-06T04:00:00Z
370,Laser Myringotomy,"Laser Myringotomy Regularly Scheduled Series RSS Live   09/06/2000  2000  09  ",Regularly Scheduled Series,1,,M,2,Live,2000-09-06T04:00:00Z
371,"Preservation and Change, The Ten Thousand Things","Preservation and Change, The Ten Thousand Things Regularly Scheduled Series RSS Live   09/06/2000  2000  09  ",Regularly Scheduled Series,1,,M,2,Live,2000-09-06T04:00:00Z
372,Surgical Grand Rounds,"Surgical Grand Rounds Regularly Scheduled Series RSS Live   09/06/2000  2000  09  ",Regularly Scheduled Series,1,,M,2,Live,2000-09-06T04:00:00Z
373,"When in doubt, don't get an EEG; The clinical utility in clildren of interictal EEG under conditions","When in doubt, don't get an EEG; The clinical utility in clildren of interictal EEG under conditions Regularly Scheduled Series RSS Live   09/08/2000  2000  09  ",Regularly Scheduled Series,1,,M,2,Live,2000-09-08T04:00:00Z
374,Hematology/Oncology Grand Rounds,"Hematology/Oncology Grand Rounds Regularly Scheduled Series RSS Live   09/08/2000  2000  09  ",Regularly Scheduled Series,1,,M,2,Live,2000-09-08T04:00:00Z
375,How to Prepare for an Academic Career in Pathology,"How to Prepare for an Academic Career in Pathology Regularly Scheduled Series RSS Live   09/11/2000  2000  09  ",Regularly Scheduled Series,1,,M,2,Live,2000-09-11T04:00:00Z
376,Cincinnati Society of Ophthalmology 2000,"Cincinnati Society of Ophthalmology 2000 Regularly Scheduled Series RSS Live All grand rounds for 2000  09/13/2000  2000  09  ",Regularly Scheduled Series,1,All grand rounds for 2000,M,2,Live,2000-09-13T04:00:00Z
377,Anterior Segment Reconstruction Following Ocular Trauma,"Anterior Segment Reconstruction Following Ocular Trauma Regularly Scheduled Series RSS Live   09/13/2000  2000  09  ",Regularly Scheduled Series,1,,M,2,Live,2000-09-13T04:00:00Z
378,Antihypertensive Therapy:  Benefits Beyond Blood Pressure Control,"Antihypertensive Therapy:  Benefits Beyond Blood Pressure Control Regularly Scheduled Series RSS Live   09/13/2000  2000  09  ",Regularly Scheduled Series,1,,M,2,Live,2000-09-13T04:00:00Z
379,Recurrent Abdominal Perianal Sarcoma,"Recurrent Abdominal Perianal Sarcoma Regularly Scheduled Series RSS Live   09/13/2000  2000  09  ",Regularly Scheduled Series,1,,M,2,Live,2000-09-13T04:00:00Z
380,Neuro-Oncology Tumor Board (1.50),"Neuro-Oncology Tumor Board (1.50) Regularly Scheduled Series RSS Live   09/13/2000  2000  09  ",Regularly Scheduled Series,1,,M,2,Live,2000-09-13T04:00:00Z
381,Preventative Medication in Migraine,"Preventative Medication in Migraine Regularly Scheduled Series RSS Live   09/13/2000  2000  09  ",Regularly Scheduled Series,1,,M,2,Live,2000-09-13T04:00:00Z
382,Surgery of the Ocular Surface,"Surgery of the Ocular Surface Regularly Scheduled Series RSS Live   09/13/2000  2000  09  ",Regularly Scheduled Series,1,,M,2,Live,2000-09-13T04:00:00Z
383,Head & Neck Cancer Therapy:  What's New?,"Head & Neck Cancer Therapy:  What's New? Regularly Scheduled Series RSS Live   09/13/2000  2000  09  ",Regularly Scheduled Series,1,,M,2,Live,2000-09-13T04:00:00Z
384,Neuropsychological Perspectives on Severe Mental Illness,"Neuropsychological Perspectives on Severe Mental Illness Regularly Scheduled Series RSS Live   09/13/2000  2000  09  ",Regularly Scheduled Series,1,,M,2,Live,2000-09-13T04:00:00Z
385,Surgical Grand Rounds,"Surgical Grand Rounds Regularly Scheduled Series RSS Live   09/13/2000  2000  09  ",Regularly Scheduled Series,1,,M,2,Live,2000-09-13T04:00:00Z
386,General Medicine-Clinical Conference 2000,"General Medicine-Clinical Conference 2000 Regularly Scheduled Series RSS Live All grand rounds for 2000  09/15/2000  2000  09  ",Regularly Scheduled Series,1,All grand rounds for 2000,M,2,Live,2000-09-15T04:00:00Z
387,Neuromuscular Conditions Associated with Malignancies,"Neuromuscular Conditions Associated with Malignancies Regularly Scheduled Series RSS Live   09/15/2000  2000  09  ",Regularly Scheduled Series,1,,M,2,Live,2000-09-15T04:00:00Z
388,Hematology/Oncology Grand Rounds,"Hematology/Oncology Grand Rounds Regularly Scheduled Series RSS Live   09/15/2000  2000  09  ",Regularly Scheduled Series,1,,M,2,Live,2000-09-15T04:00:00Z
389,Effects of a Patient-oriented Decision Aid on the Process and Outcomes of Colorectal Cancer Screenin,"Effects of a Patient-oriented Decision Aid on the Process and Outcomes of Colorectal Cancer Screenin Regularly Scheduled Series RSS Live   09/15/2000  2000  09  ",Regularly Scheduled Series,1,,M,2,Live,2000-09-15T04:00:00Z
390,How to Prepare an Effective Presentation,"How to Prepare an Effective Presentation Regularly Scheduled Series RSS Live   09/18/2000  2000  09  ",Regularly Scheduled Series,1,,M,2,Live,2000-09-18T04:00:00Z
391,Council of Child & Adolescent Psychiatry 2000,"Council of Child & Adolescent Psychiatry 2000 Regularly Scheduled Series RSS Live All grand rounds for 2000  09/19/2000  2000  09  ",Regularly Scheduled Series,1,All grand rounds for 2000,M,2,Live,2000-09-19T04:00:00Z
392,Tourette's Disorder,"Tourette's Disorder Regularly Scheduled Series RSS Live   09/19/2000  2000  09  ",Regularly Scheduled Series,1,,M,2,Live,2000-09-19T04:00:00Z
393,Comparison of Local Anesthesia for Regional Anesthesia in Children,"Comparison of Local Anesthesia for Regional Anesthesia in Children Regularly Scheduled Series RSS Live   09/20/2000  2000  09  ",Regularly Scheduled Series,1,,M,2,Live,2000-09-20T04:00:00Z
394,Cincinnati Psychiatric Society 2000,"Cincinnati Psychiatric Society 2000 Regularly Scheduled Series RSS Live All grand rounds for 2000  09/20/2000  2000  09  ",Regularly Scheduled Series,1,All grand rounds for 2000,M,2,Live,2000-09-20T04:00:00Z
395,The Beginning of Wisdom is Never Calling a Patient a Borderline,"The Beginning of Wisdom is Never Calling a Patient a Borderline Regularly Scheduled Series RSS Live Cincinnati Psychiatric Society  09/20/2000  2000  09  ",Regularly Scheduled Series,1,Cincinnati Psychiatric Society,M,2,Live,2000-09-20T04:00:00Z
396,Lung Cancer,"Lung Cancer Regularly Scheduled Series RSS Live   09/20/2000  2000  09  ",Regularly Scheduled Series,1,,M,2,Live,2000-09-20T04:00:00Z
397,Residents' Clinical Vignettes,"Residents' Clinical Vignettes Regularly Scheduled Series RSS Live   09/20/2000  2000  09  ",Regularly Scheduled Series,1,,M,2,Live,2000-09-20T04:00:00Z
398,Surgical Management of non-small cell lung cancer,"Surgical Management of non-small cell lung cancer Regularly Scheduled Series RSS Live   09/20/2000  2000  09  ",Regularly Scheduled Series,1,,M,2,Live,2000-09-20T04:00:00Z
399,Neuro-Oncology Tumor Board (1.50),"Neuro-Oncology Tumor Board (1.50) Regularly Scheduled Series RSS Live   09/20/2000  2000  09  ",Regularly Scheduled Series,1,,M,2,Live,2000-09-20T04:00:00Z
400,Lyme Disease,"Lyme Disease Regularly Scheduled Series RSS Live   09/20/2000  2000  09  ",Regularly Scheduled Series,1,,M,2,Live,2000-09-20T04:00:00Z
401,Information Technology in Ophthalmology,"Information Technology in Ophthalmology Regularly Scheduled Series RSS Live   09/20/2000  2000  09  ",Regularly Scheduled Series,1,,M,2,Live,2000-09-20T04:00:00Z
402,Choices in Bone Grafting,"Choices in Bone Grafting Regularly Scheduled Series RSS Live   09/20/2000  2000  09  ",Regularly Scheduled Series,1,,M,2,Live,2000-09-20T04:00:00Z
403,Successful Aging-A Sixty Year Study,"Successful Aging-A Sixty Year Study Regularly Scheduled Series RSS Live   09/20/2000  2000  09  ",Regularly Scheduled Series,1,,M,2,Live,2000-09-20T04:00:00Z
404,Surgical Grand Rounds,"Surgical Grand Rounds Regularly Scheduled Series RSS Live   09/20/2000  2000  09  ",Regularly Scheduled Series,1,,M,2,Live,2000-09-20T04:00:00Z
405,Hematology/Oncology Grand Rounds,"Hematology/Oncology Grand Rounds Regularly Scheduled Series RSS Live   09/22/2000  2000  09  ",Regularly Scheduled Series,1,,M,2,Live,2000-09-22T04:00:00Z
406,Facial Nerve Palsies,"Facial Nerve Palsies Regularly Scheduled Series RSS Live   09/22/2000  2000  09  ",Regularly Scheduled Series,1,,M,2,Live,2000-09-22T04:00:00Z
407,Relationship Between Structure and Function in the Normal Kidney,"Relationship Between Structure and Function in the Normal Kidney Regularly Scheduled Series RSS Live   09/25/2000  2000  09  ",Regularly Scheduled Series,1,,M,2,Live,2000-09-25T04:00:00Z
408,Two New Techniques in Treating Chronic Low Back Pain,"Two New Techniques in Treating Chronic Low Back Pain Regularly Scheduled Series RSS Live   09/27/2000  2000  09  ",Regularly Scheduled Series,1,,M,2,Live,2000-09-27T04:00:00Z
409,Choliangiosarcoma,"Choliangiosarcoma Regularly Scheduled Series RSS Live   09/27/2000  2000  09  ",Regularly Scheduled Series,1,,M,2,Live,2000-09-27T04:00:00Z
410,Cytoskeletal Role in the Contractile Function of Hypertrophied Myocardium,"Cytoskeletal Role in the Contractile Function of Hypertrophied Myocardium Regularly Scheduled Series RSS Live   09/27/2000  2000  09  ",Regularly Scheduled Series,1,,M,2,Live,2000-09-27T04:00:00Z
411,Multidisciplinary Solid Tumor Board,"Multidisciplinary Solid Tumor Board Regularly Scheduled Series RSS Live   09/27/2000  2000  09  ",Regularly Scheduled Series,1,,M,2,Live,2000-09-27T04:00:00Z
412,Neuro-Oncology Tumor Board (1.50),"Neuro-Oncology Tumor Board (1.50) Regularly Scheduled Series RSS Live   09/27/2000  2000  09  ",Regularly Scheduled Series,1,,M,2,Live,2000-09-27T04:00:00Z
413,Epilepsy in the Elderly,"Epilepsy in the Elderly Regularly Scheduled Series RSS Live   09/27/2000  2000  09  ",Regularly Scheduled Series,1,,M,2,Live,2000-09-27T04:00:00Z
414,Fluorescein and ICG Angiography Conference,"Fluorescein and ICG Angiography Conference Regularly Scheduled Series RSS Live   09/27/2000  2000  09  ",Regularly Scheduled Series,1,,M,2,Live,2000-09-27T04:00:00Z
415,Charcot Disease of the Foot and Ankle,"Charcot Disease of the Foot and Ankle Regularly Scheduled Series RSS Live   09/27/2000  2000  09  ",Regularly Scheduled Series,1,,M,2,Live,2000-09-27T04:00:00Z
416,Treatment of Chronic Depression:  New Findings,"Treatment of Chronic Depression:  New Findings Regularly Scheduled Series RSS Live   09/27/2000  2000  09  ",Regularly Scheduled Series,1,,M,2,Live,2000-09-27T04:00:00Z
417,Surgical Grand Rounds,"Surgical Grand Rounds Regularly Scheduled Series RSS Live   09/27/2000  2000  09  ",Regularly Scheduled Series,1,,M,2,Live,2000-09-27T04:00:00Z
418,Management of Preeclampsia/HELLP Syndrome,"Management of Preeclampsia/HELLP Syndrome Regularly Scheduled Series RSS Live   09/28/2000  2000  09  ",Regularly Scheduled Series,1,,M,2,Live,2000-09-28T04:00:00Z
419,Hematology/Oncology Grand Rounds,"Hematology/Oncology Grand Rounds Regularly Scheduled Series RSS Live   09/29/2000  2000  09  ",Regularly Scheduled Series,1,,M,2,Live,2000-09-29T04:00:00Z
420,Oxidants in Vascular Signaling,"Oxidants in Vascular Signaling Regularly Scheduled Series RSS Live   10/02/2000  2000  10  ",Regularly Scheduled Series,1,,M,2,Live,2000-10-02T04:00:00Z
421,Bone Metastasis with Unknown Primary,"Bone Metastasis with Unknown Primary Regularly Scheduled Series RSS Live   10/04/2000  2000  10  ",Regularly Scheduled Series,1,,M,2,Live,2000-10-04T04:00:00Z
422,"Faculty Development Workshop Series, Session 3","Faculty Development Workshop Series, Session 3 Regularly Scheduled Series RSS Live   10/04/2000  2000  10  ",Regularly Scheduled Series,1,,M,2,Live,2000-10-04T04:00:00Z
423,The Hospitalist Movement: Key Issues for Academia,"The Hospitalist Movement: Key Issues for Academia Regularly Scheduled Series RSS Live   10/04/2000  2000  10  ",Regularly Scheduled Series,1,,M,2,Live,2000-10-04T04:00:00Z
424,Neuro-Oncology Tumor Board (1.50),"Neuro-Oncology Tumor Board (1.50) Regularly Scheduled Series RSS Live   10/04/2000  2000  10  ",Regularly Scheduled Series,1,,M,2,Live,2000-10-04T04:00:00Z
425,Clinical and Biochemical Aspects of Disorders of the Trifunctional Protein,"Clinical and Biochemical Aspects of Disorders of the Trifunctional Protein Regularly Scheduled Series RSS Live   10/04/2000  2000  10  ",Regularly Scheduled Series,1,,M,2,Live,2000-10-04T04:00:00Z
426,Intraocular Lymphoma,"Intraocular Lymphoma Regularly Scheduled Series RSS Live   10/04/2000  2000  10  ",Regularly Scheduled Series,1,,M,2,Live,2000-10-04T04:00:00Z
427,Evaluation and Treatment of Soft Tissue Tumors,"Evaluation and Treatment of Soft Tissue Tumors Regularly Scheduled Series RSS Live   10/04/2000  2000  10  ",Regularly Scheduled Series,1,,M,2,Live,2000-10-04T04:00:00Z
428,Management of Neck in Primary Head and Neck Squamous Cell Carcinoma,"Management of Neck in Primary Head and Neck Squamous Cell Carcinoma Regularly Scheduled Series RSS Live   10/04/2000  2000  10  ",Regularly Scheduled Series,1,,M,2,Live,2000-10-04T04:00:00Z
429,The Acute and Chronic Impact of Stress Hormones on Memory Performance and Hippocampal Function,"The Acute and Chronic Impact of Stress Hormones on Memory Performance and Hippocampal Function Regularly Scheduled Series RSS Live   10/04/2000  2000  10  ",Regularly Scheduled Series,1,,M,2,Live,2000-10-04T04:00:00Z
430,Surgical Grand Rounds,"Surgical Grand Rounds Regularly Scheduled Series RSS Live   10/04/2000  2000  10  ",Regularly Scheduled Series,1,,M,2,Live,2000-10-04T04:00:00Z
431,Hematology/Oncology Grand Rounds,"Hematology/Oncology Grand Rounds Regularly Scheduled Series RSS Live   10/06/2000  2000  10  ",Regularly Scheduled Series,1,,M,2,Live,2000-10-06T04:00:00Z
432,The Role of Anabolic Therapies in Rehab Medicine,"The Role of Anabolic Therapies in Rehab Medicine Regularly Scheduled Series RSS Live   10/06/2000  2000  10  ",Regularly Scheduled Series,1,,M,2,Live,2000-10-06T04:00:00Z
433,Dayton Ophthalmological Society Meeting,"Dayton Ophthalmological Society Meeting Regularly Scheduled Series RSS Live   10/10/2000  2000  10  ",Regularly Scheduled Series,1,,M,2,Live,2000-10-10T04:00:00Z
434,HCV-Associated Cirrhosis,"HCV-Associated Cirrhosis Regularly Scheduled Series RSS Live   10/10/2000  2000  10  ",Regularly Scheduled Series,1,,M,2,Live,2000-10-10T04:00:00Z
435,Dr. Sellick's Maneuver,"Dr. Sellick's Maneuver Regularly Scheduled Series RSS Live   10/11/2000  2000  10  ",Regularly Scheduled Series,1,,M,2,Live,2000-10-11T04:00:00Z
436,Antimicrobial Prophylaxis in Ophthalmic Surgery,"Antimicrobial Prophylaxis in Ophthalmic Surgery Regularly Scheduled Series RSS Live   10/11/2000  2000  10  ",Regularly Scheduled Series,1,,M,2,Live,2000-10-11T04:00:00Z
437,Rectal Cancer/Colorectal Cancer,"Rectal Cancer/Colorectal Cancer Regularly Scheduled Series RSS Live   10/11/2000  2000  10  ",Regularly Scheduled Series,1,,M,2,Live,2000-10-11T04:00:00Z
438,Hearing Patients- Stories From Medicine,"Hearing Patients- Stories From Medicine Regularly Scheduled Series RSS Live   10/11/2000  2000  10  ",Regularly Scheduled Series,1,,M,2,Live,2000-10-11T04:00:00Z
439,Magnesium Mechanism and Other In Vitro Mechanisms of Therapy for Cerebral Vasospasm,"Magnesium Mechanism and Other In Vitro Mechanisms of Therapy for Cerebral Vasospasm Regularly Scheduled Series RSS Live   10/11/2000  2000  10  ",Regularly Scheduled Series,1,,M,2,Live,2000-10-11T04:00:00Z
440,Uses and Abuses of Antibiotics in Ophthalmology,"Uses and Abuses of Antibiotics in Ophthalmology Regularly Scheduled Series RSS Live   10/11/2000  2000  10  ",Regularly Scheduled Series,1,,M,2,Live,2000-10-11T04:00:00Z
441,IM Nails for Trauma Patients,"IM Nails for Trauma Patients Regularly Scheduled Series RSS Live   10/11/2000  2000  10  ",Regularly Scheduled Series,1,,M,2,Live,2000-10-11T04:00:00Z
442,Retropharyngeal Abscess-Treatment and Complications,"Retropharyngeal Abscess-Treatment and Complications Regularly Scheduled Series RSS Live   10/11/2000  2000  10  ",Regularly Scheduled Series,1,,M,2,Live,2000-10-11T04:00:00Z
443,Psychogenetics of Antisychotic Drug Response,"Psychogenetics of Antisychotic Drug Response Regularly Scheduled Series RSS Live   10/11/2000  2000  10  ",Regularly Scheduled Series,1,,M,2,Live,2000-10-11T04:00:00Z
444,Surgical Grand Rounds,"Surgical Grand Rounds Regularly Scheduled Series RSS Live   10/11/2000  2000  10  ",Regularly Scheduled Series,1,,M,2,Live,2000-10-11T04:00:00Z
445,Hematology/Oncology Grand Rounds,"Hematology/Oncology Grand Rounds Regularly Scheduled Series RSS Live   10/13/2000  2000  10  ",Regularly Scheduled Series,1,,M,2,Live,2000-10-13T04:00:00Z
446,Does the Relative Importance of Individual Determinants of Health Utilization Vary According to Insu,"Does the Relative Importance of Individual Determinants of Health Utilization Vary According to Insu Regularly Scheduled Series RSS Live   10/13/2000  2000  10  ",Regularly Scheduled Series,1,,M,2,Live,2000-10-13T04:00:00Z
447,Spinal Injection,"Spinal Injection Regularly Scheduled Series RSS Live   10/13/2000  2000  10  ",Regularly Scheduled Series,1,,M,2,Live,2000-10-13T04:00:00Z
448,Odontogenic Tumors,"Odontogenic Tumors Regularly Scheduled Series RSS Live   10/16/2000  2000  10  ",Regularly Scheduled Series,1,,M,2,Live,2000-10-16T04:00:00Z
449,Trans-Septal Frontal Sinusotomy and Modified Lothrop,"Trans-Septal Frontal Sinusotomy and Modified Lothrop Regularly Scheduled Series RSS Live   10/17/2000  2000  10  ",Regularly Scheduled Series,1,,M,2,Live,2000-10-17T04:00:00Z
450,Colon Cancer/Chondrosarcoma Cancer,"Colon Cancer/Chondrosarcoma Cancer Regularly Scheduled Series RSS Live   10/18/2000  2000  10  ",Regularly Scheduled Series,1,,M,2,Live,2000-10-18T04:00:00Z
451,Pap Smear Update,"Pap Smear Update Regularly Scheduled Series RSS Live   10/18/2000  2000  10  ",Regularly Scheduled Series,1,,M,2,Live,2000-10-18T04:00:00Z
452,Neuro-Ophthalmology Conference,"Neuro-Ophthalmology Conference Regularly Scheduled Series RSS Live   10/18/2000  2000  10  ",Regularly Scheduled Series,1,,M,2,Live,2000-10-18T04:00:00Z
453,Ankle Fusion vs. Ankle Replacement,"Ankle Fusion vs. Ankle Replacement Regularly Scheduled Series RSS Live   10/18/2000  2000  10  ",Regularly Scheduled Series,1,,M,2,Live,2000-10-18T04:00:00Z
454,Fungal Rhinosinusitis,"Fungal Rhinosinusitis Regularly Scheduled Series RSS Live   10/18/2000  2000  10  ",Regularly Scheduled Series,1,,M,2,Live,2000-10-18T04:00:00Z
455,"Intimacy, Mid-Life and Infidelity","Intimacy, Mid-Life and Infidelity Regularly Scheduled Series RSS Live   10/18/2000  2000  10  ",Regularly Scheduled Series,1,,M,2,Live,2000-10-18T04:00:00Z
456,Psychotropic Medications and Sexual Dysfunction,"Psychotropic Medications and Sexual Dysfunction Regularly Scheduled Series RSS Live   10/18/2000  2000  10  ",Regularly Scheduled Series,1,,M,2,Live,2000-10-18T04:00:00Z
457,New Therapies for Interstitial Lung Disease,"New Therapies for Interstitial Lung Disease Regularly Scheduled Series RSS Live   10/18/2000  2000  10  ",Regularly Scheduled Series,1,,M,2,Live,2000-10-18T04:00:00Z
458,Surgical Grand Rounds,"Surgical Grand Rounds Regularly Scheduled Series RSS Live   10/18/2000  2000  10  ",Regularly Scheduled Series,1,,M,2,Live,2000-10-18T04:00:00Z
459,The SOAP-51: A Consumer-centered Health Status Measure for Individuals with Schizophrenia Living In,"The SOAP-51: A Consumer-centered Health Status Measure for Individuals with Schizophrenia Living In Regularly Scheduled Series RSS Live   10/19/2000  2000  10  ",Regularly Scheduled Series,1,,M,2,Live,2000-10-19T04:00:00Z
460,Hematology/Oncology Grand Rounds,"Hematology/Oncology Grand Rounds Regularly Scheduled Series RSS Live   10/20/2000  2000  10  ",Regularly Scheduled Series,1,,M,2,Live,2000-10-20T04:00:00Z
461,Disseminated Intravascular Coagulations Resulting in Amputation,"Disseminated Intravascular Coagulations Resulting in Amputation Regularly Scheduled Series RSS Live   10/20/2000  2000  10  ",Regularly Scheduled Series,1,,M,2,Live,2000-10-20T04:00:00Z
462,Identifying Thymomas,"Identifying Thymomas Regularly Scheduled Series RSS Live   10/23/2000  2000  10  ",Regularly Scheduled Series,1,,M,2,Live,2000-10-23T04:00:00Z
463,Anatomy for Anesthesiologists,"Anatomy for Anesthesiologists Regularly Scheduled Series RSS Live   10/25/2000  2000  10  ",Regularly Scheduled Series,1,,M,2,Live,2000-10-25T04:00:00Z
464,Cholestatic Liver Disease,"Cholestatic Liver Disease Regularly Scheduled Series RSS Live   10/25/2000  2000  10  ",Regularly Scheduled Series,1,,M,2,Live,2000-10-25T04:00:00Z
465,Perioperative Pain Management,"Perioperative Pain Management Regularly Scheduled Series RSS Live   10/25/2000  2000  10  ",Regularly Scheduled Series,1,,M,2,Live,2000-10-25T04:00:00Z
466,Developing Alzheimer's Disease:  The Search for Biomarkers,"Developing Alzheimer's Disease:  The Search for Biomarkers Regularly Scheduled Series RSS Live   10/25/2000  2000  10  ",Regularly Scheduled Series,1,,M,2,Live,2000-10-25T04:00:00Z
467,Hematology/Oncology Grand Rounds,"Hematology/Oncology Grand Rounds Regularly Scheduled Series RSS Live   10/27/2000  2000  10  ",Regularly Scheduled Series,1,,M,2,Live,2000-10-27T04:00:00Z
468,Measurement and relationship of disease activity and disease damage in childhooh-onset SLE.,"Measurement and relationship of disease activity and disease damage in childhooh-onset SLE. Regularly Scheduled Series RSS Live   10/27/2000  2000  10  ",Regularly Scheduled Series,1,,M,2,Live,2000-10-27T04:00:00Z
469,Stroke in Children,"Stroke in Children Regularly Scheduled Series RSS Live   10/27/2000  2000  10  ",Regularly Scheduled Series,1,,M,2,Live,2000-10-27T04:00:00Z
470,The Role of Hormones in Breast Cancer,"The Role of Hormones in Breast Cancer Regularly Scheduled Series RSS Live   10/28/2000  2000  10  ",Regularly Scheduled Series,1,,M,2,Live,2000-10-28T04:00:00Z
